score,review
2,무료로 봤는데 다행히다
1,이제부터 이 작품 감독 믿고 거른다
1,진짜 별점0점은없냐? 진짜개더럽다 하..연기인거알지만 진짜 개빡친다;;가영이개토나온다 ㄹㅇ..
7,이성경이 이렇게 이뻤나.. 뭔가 메세지도 있고 좋은데 결말이 좀 흐지부지라 아쉽다..
1,안녕하세요 여러분 제가 살면서영화를 보면서 재미없다고 생각한적이한번도 없습니다. 근데 이영화는 정말 재미도없고 감동도 없군요 이상입니다
1,역대급 개노잼 진짜로ㄹㅇ
7,하도 재미없대서 기대없이 봐서 그런가 재밌음ㅋㅋㅋ 보다가 몇 번 빵 터지고ㅋ 속아서 본 노잼영화들에 비하면 아주 양반인 영화
8,황우슬혜 완전 웃겨 ㅋㅋㅋㅋ
1,김민재 앞으로 믿고 거른다
10,페미들 와서 젊고 이쁜 여자가 유해진 좋아해서 별점테러 하나본데 최근 본 국가부도의날 보다 훨씬 뛰어나고 연기력도 좋음. 여러 감정들이 느껴져서 좋았음.
1,여기서 나온 여주인공이 불쌍하다 못해 안쓰럽다
5,그냥 킬링타임용 유해진의 연기는 항상 자연스럽다
1,쉣더뻑.~~!!!~!!!
10,재밌기만 하구만 불편한 그 분들...
10,마지막에 개울었어요 진짜 슬퍼요
8,가족과함께 웃으며 봤지만 마음 뭉클해지는 영화
8,처음에 보다가 뭐지?끌까? 했는데 그냥 시간이 남아서 계속봤습니다. 아들친구가 아빠를 좋아하는건 너무별로지만 그냥 시간떼우기용으로 볼만하네요..그게없었다면 더감동이었을텐데 말이죠... 김민재.유해진씨 연기진짜 좋네요...
10,울고 웃엇던 영화 ! 마음이 따듯해지는 영화입니다
10,난 괜찮은데 다들 왜그러는지...나쁘진않고 볼만합니다
1,연인과  헤어질때  보는영화
1,이상한 러브라인에 결승전까지가서 뻘짓하는 아들놈도 발암이고 해진이형도 제대로 된 영화 주연 좀 시켜주지 럭키정도만 됐어도 10점 줬는데
10,그냥 뭐 볼만하던데? 유해진이라 볼만했던것 같음 물론 럭키에 비하면 절대 앙댐
10,"처음엔 뭔 내용이..그래도 유해진 연기 디테일 좋았고좋은 배우들 많이 나왔고 연기력도 좋았는데 77만명.. 안타깝네요ㅎㅎ나름 뭐야 이게 하면서도 웃었던 영화유해진, 김민재, 나문희 셋의 관계나 다른 부분적 내용만 잘..."
1,소재 자체도 더럽고 저급함 으 왜 0점이 없죠
10,나만 재밌었냐..  난 갠적으로 좋았음 ㅇㅅㅇ..
10,대박입니다 어서보세요
10,나름 재밌었어요 가볍게 보기로 ㅋㅋㅋ 자기 주장만 하는 가족 대화의 방법을 생각해볼 수있는 시간입니다 보수적 여자관에 대하여 말하는 대사가 있어 별점 테러 당한듯
10,웃다울다 너무 재밌게 보았어요. 유해진 연기력이야 말한필요도 없고 김민재의 재발견. 연기 넘 잘하고 영화를 위해 얼마나 열심히 몸만들었을지 존경스럽네요. 나문희씨는 저희 엄마 보는것 같았어요.ㅋㅋ 암튼 따듯하고 재밌...
10,이성경 예뻐서 볼만함 스토리도 아재랑 어린애랑 사랑한다는 것도 나름 재밌고근데 충격은 이거 본지 몇달 지났는데주인공 여진구인지 알았는데 아니었단 게 개 충격....여진구랑 닮은 정도가 아니라 완전 도플갱언데 ㄷㄷ
6,전혀 예상치 못한 스토리라 새롭긴 했음 걍 평범
8,유쾌하게 볼만 하고만 왜 이렇게 불편해 하냐 만약 역활만 여자 라미란 배우로 캐스팅 했으면 아마 천만 갔을걸 단지 남자 유해진이 주인공이라 불편한걸로밖에는 안보인다 가볍게 웃긴영화이고만 8점대이다
7,미국가는 비행기안에서 봤는데 덕분에 많이 웃었습니다. ㅎㅎ유해진연기는 정말 최고입니다.
2,개 똥같은 영화네 진짜 이런거 첨 써본다;;;
10,좋네요 재미있게 보았습니다
10,편하게 보기좋아요ㅡㅎㅎ
1,"영화를 다 보고 난 후, 기분 나쁘고 욕 나오고. . 막장!시간과 돈이 아까운 영화!!"
2,이게 왜 제목이 레슬러인지 모르겠다...
1,이게 뭔 영화야 정말 돈많으면 아! 아니다 돈많아도 보지마세요 억지 슬픔 억지 웃음 만들어 내고 배우들이 아깝다
8,재밌게 봤어요 가족영화 맞네요
1,시나리오 누가썻는지 참 잘썻네ㅋㅋ
10,7점정도가 적절해 10점 주고갑니다.
1,별로 유명하지 않은 한식집에 가서 맛대가리 없는 잡탕을 먹은 기분. 무엇을 먹었는지.. 어떤맛이었는지 하나도 기억나지않고 찝찝함만...
8,어설픈 영화들 보다 확실한 장르의 이런영화가 훨 낫다. 난 재밌게 봤음.
10,"영화 리뷰, 뉴스 댓글 또한 안다는데 이거 너무 재미있는데 왜 다들 재미없다고 난리인지 ;;"
8,혼자 볼만합니다 본인 행복이 중요하죠~
6,성경찌 너무 이뻐요 흑흙ㅠㅠ
1,제목을 레슬러로 지은건 페이크고 내용은 참..감독 머리속에 뭐가 들었나 궁금하네 간간히 나오는 성적농담도 하나도 안웃기고 진심 유해진이 이런 3류보다 못한 영화에 출연한 이유를 모르겠다 요새 vod시장이 커져서 아직...
10,평점 왜이러니 나는 재밌게 봤당..
10,유해진 나오는영화는꼭보는데 생각보다는..
1,제목을 왜 레슬러로 지었지? 3류보다 못한 4류쯤 되는 영화다. 더 욕해주고 싶지만 그럴 가치도 없네. 안 본 사람들은 그냥 영화 재미있을까? 이런 궁금증 갖지 말고 안 보는 걸 추천한다.
8,진짜 평 안좋아 안보려다 시간이 되어 봤는데 코믹도 많고 재미있는데 뭘 얼마나 바라는지 우리나라는 조폭 안나오면 흥행을 못하는 불편한 혈실
8,평이 박해서 넘길 뻔했네요. 드라마 장르는 안 보는 편인데 시간이 남아 우연히 봤습니다. 저는 기대 이상으로 재밌게 봤어요.
8,그냥 그랫어여 ㅎㅎㅎ볼먼했어요
1,너무 뻔한..장면들이나와서..그냥스킵하고싶은 영화
1,돈이아깝습니다후덜덜
8,영화 감상평을 너무 늦게 작성합니다.재미있었어요~~~!
10,황우슬혜.... 아 매력넘치네
1,그냥 쓰레기 같은 영화. 도데체 뭔 애기를 하고 싶은건지. 평점 1점도 아까운 영화. 감독아. 다시는 영화 찍지 말고 다른 일 찾아보시길
8,훈훈하고 보기 좋았습니다
2,이 영화보고 전국 아저씨들이 착각에 빠져 젊은 여자들보고 성적대상 연애대상으로 생각할까봐 무서운 영화였어요...
4,음.... 이게 로맨스인지 뭔지 모르겠닼ㅋㅋㅋㅋ
1,보다가 포기했다1점도 아깝다
10,이거 제2의 클레멘타인 가야 하나요? ~이 영화를 보고 암이 낳았습니다~
2,"킬링타임으로 9점 드리려다, 마지막 아빠와 아들의 레슬링으로 7점을 내렸네요.."
2,제묙과 전혀 상관없는 감동도없고 재미도..
8,사랑도 있고 스포츠도 있고 코미디도 있고 가족도 있는데 어느것 하나 강한 맛이 없는 일상물
8,비행기안에서방금봤음재미없다고솔직히왜이렇게난리인지모르겠음난 솔까 재밌게봤음 진심임!영화 괜찮아요!!
8,그냥 웃을수있는영화아빠를 좋아한다는 말에 헉~~~
10,엉도우아라어아다아이나아ㅏㄴ
1,다 1점인데 평점 어케 6점대임? 알바의힘? 아님 5점 밑으로 정산안하는 네이버매크로의 힘?
3,부자간의 정을 묘사하려했으나 폭망
10,배우들 연기도 잘하고...영화 내용 좋더만...재밌게 잘봤음...
8,아놔 개 빵터졌네 ㅋㅋㅋ
1,시나리오 쓴사람이나 이딴걸만드는 감독 제작사나 출연하는 배우들이 이해가 안갈정도로 OOO기 입니다 시간을 버리는 정도가 아니라 정신에도 나쁜영향을 끼칠수있으니 유념하세요~
10,암 생각없이 보세요참바다씨  화이팅!!
6,재미 있내. ㅋㅋ 평점들 본니 왜그런지 알겠다
10,저는 사람들이 왜 평점1점밖에안주는지 모르겠네요 부모사이의 갈등을 재미있게 잘풀어준거같은데 .. 저는 이영화보면서 공감많이했습니다 감사히봤습니다!!
10,너무 재밌게 잘봤네요 돈주고 보세요유해진 아저씨 연기 체고넘넘 조아야
10,난 재미있었는데 배우들이 전부다 연기를 맛깔나게 잘해줘서 정말 산뜻하게 따뜻하게만 봤는데 이거 당시 경쟁작 알바라도 쓴건가 굉장히 구성도 잘짜여진 근래 드문 수작이었다. 특히 아빠와 아들이 싸우는 장면과 회상장면 크...
1,이렇게 돈 쳐바른 상업영화보다 제작비 2000만원에 만든 레슬링 영화 튼튼이의 모험이 객관적으로도 훨씬 재미있고 진정성 있었습니다.
2,성소수자들을 나타내기 위한 영화인건 알았지만 확실히 지나친 부분들이 많았다 조금은 어려운 주제였기 때문에 그 만큼 작품도 어려웠다
1,충격이다 역겨운 내용에 아들이 아빠한태 주먹질하질않나 친구 아빠 짝사랑하질않나 충격적이다 진짜 싫다
6,마동석 기대햇는데 별로엿어요 ㅠㅠ
1,정말 예상치도 못한 전개에 허를 내두르네요 돈주고 보기엔 아까운 영화입니다
2,그저그런 재미없는영화네요
5,작위적인 설정 및 코미디
10,난 재밌게 봤는데... 호불호 극심하게 갈리는듯?
6,그냥저냥  소소~~잔잔한 재미 ㅋ ㅋ
8,재미 있는 영화 보고 싶다.
5,그냥그럭저럭볼만헀네요
6,재밌게 잘 봤습니다!!!
1,헐.... 딱히 이 말 밖에
6,다들 부정적인 부분만 보는데 솔직히 러브라인은 좀 그랬어도 가족에 대한 사랑이나 현대 사회에서 부모에게 이끌려 자신이 원하는것을 하지 못하고 살아가는 자식들에 대한 내용과 부모에게 효도하며 부모는 자식을 위해 자신의...
6,가볍게 가볍게 볼수있는 영화인것 같습니다 :)
2,진정 이병헌감독각색??!!
4,제목은 왜 레슬러야. 유해진의 예쁘고 어린 여자들이라 해라. 1점도 아까운데 황우슬혜때문에 4점이라도 준다.
4,감독님 당갈보고 반성 하세요.
1,참 할말없다 와 진짜 첨으로글쓴다
1,유해진연기가 아까워요ㅜ
1,다른영화보세요...
6,ㅋㅋㅋㅋ 킬링타임으로만..킬링타임도 좀 부족할 수는 있음.
4,서울우유 광고같음. 스토리는 스포츠 부자지간에 끼어든 로리타병걸린 20살 재수생녀때문에 약간 흔들리는 부자지간 내용
4,에구;;;좀아깝네요..
1,쨔잔~ 10000원이 사라졌습니다~
1,ㅎㅎㅎ미친영화다 내용수준하고는 ㅉ 기분더러워요
10,평점 보고 안보다 봤는데 이리 욕먹을 영화는 아닌듯막장으로 끝난것도 아니고 살면서 동경에 대상(진경대사)한명쯤은 있을텐데~ 이성경이랑 황우슬혜가 돋보인 영화 7~8점은 되야 하기에 10점줌.
6,소소한 유머들이 좋았는데 그게 다 인것같다 근근히 이어가던 이야기가 후반에는 아예 힘을 잃고 감정의 과잉으로만 표현되니 보는 사람 입장에선 인물들의 행동에 공감이 안간다 그냥 코믹으로만 쭉 몰고가긴 힘들었겠지?
10,그냥 소소하게 기대없이 보세요
8,그냥 영화고 볼만함. 좋은 배우에 비해서는 아깝다
1,3949ㅐㅑㅑ3ㅑ3ㅑ
1,"와.. 어쩜 저리 좋은 배우들 가지고  경기도중 산파극에, 아들 친구딸  상황극에.. 아주 막장을 달린다. 감독님. 대체 이 영화로 뭘 보여주고 뭘 말하고 싶었던거요?"
8,황우슬혜 캐릭 졸잼! ㅋㅋ
2,개.OOO.영화...꽁짜도 상영마라..국민들 뇌 이상해진다
10,ㅁㄱ왔다갔나. 못생기고 돈없는 남자가 사랑대상으로 나와서 난리인지. 감독이 말하는건 가족인데 엉뚱한걸 트집이네
4,여자하나 때문에.. ㅎㅎ
8,뭔데 평점이리 낮냐 그냥 킬링타임으로  8점은 돼겠던데
10,짱짱 재미있어요^^또 보고 싶어요ㅎ
1,개에바스러운 내용; 토악질나온다
10,내용이  감동도  있고  슬프기도하고  재미있었어요. 많은사람이  보러왔으면  줗겠네요
10,하하 좀 웃겼네요 ㅋㅋㅋㅋ
10,어플에서 무료보기되서 다시봤는데 꿀잼ㅋㅋ코미디를 잘 이끈요소가 많은데 다들 진지를 너무 잡주시는듯.. 일반적이지 않아서 웃긴요소잖아요ㅋㅋ 결말에 진짜 이루어지는걸로 나오는것도 아니고 아빠와 아들의 성장얘기가 주스토리...
9,"저는 영화를 초이스 할 때 주로 평점을 보고 초이스 합니다. 왜냐면 지금까지 평점 결과랑 영화 결과가 얼추 비슷하게 맞았거든요 근데, 영화 다 보고나서 어이가 없어서 처음으로 여기에 평점 남깁니다. 이렇게 볼만한 영..."
7,웃기긴 웃기던데 기대안하고보면볼만함
1,그냥그렇네요 실망스럽네요
10,재밌음재밌음재밌음재밌음재밌음재밌음재밌음재밌음재밌음재밌음재밌음재밌음재밌음재밌음재밌음재밌음재밌음재밌음재밌음재밌음재밌음재밌음재밌음재밌음재밌음재밌음재밌음재밌음재밌음재밌음재밌음재밌음재밌음재밌음재밌음재밌음재밌음재밌음
1,최고급 식재료를 다 모아서 개밥만든느낌이런 스토리도 투자가 되는것이 신기하다
4,가족을 위해 주변의 이야기를 철저하게 소모하고 낭비한다.
8,잼있구만 OO들은..
6,기대하고ㅈ봤는데 아쉽네요
1,와 이건 너무 심하다..
2,말도 안되느뉴내용에ㅠ억지 울음
6,역쉬 자연스러운 유해진 연기 짱~^^
2,평타칠수있었던 스토리였던것 같은데재미도 감동도 없었고 좋은배우들 가지고 그닥 좋지못한 영화를 만들어냈다
10,짇짜 재밋게봠ㅅ는디  가족들이랑보세요!!
8,가족영화~훈훈하고 잼나요~
6,재미써써용ㅎㅎ 즐거운내용이네요
4,어떻게 이런 영화를 만들수있는거지 ㅡ
2,스토리... 하.. 무료 기부 받은거지?
10,ㅋㅋㅋ나는 또라이인가? 왜케 재미있지?ㅋ
1,"레슬링 선수인 아들이, 아빠한테 레슬링 기술쓰는거. 이거 패륜아니야??? 깜놀했네. 쓰레기영화임."
2,그냥이에요 돈아까워요
1,진짜 스토리 개막장이네요 낄낄
9,정말재밌게봤습니다. 재밌고 감동적이고 인생을 돌아보게 만드네요. 세상 모든 아버지 화이팅입니다. 꼭 보셨으면 합니다.
1,ㄹㅇ 집에서 vod로 봤는데 보는데 계속 이상함을 느낌 설마싶어서 뒤로 넘기니까 답이 없어서 그냥 끔.중간에 끈 영화는 처음임 끄고 시x을 세번 외침.
1,폐륜영화 진짜 감동먹을 부분인건지 아빠 때려눕히는데  비지엠뭐냐 작가 머릿속에 뭐가들었는지 궁금하다 진짜 별로다  진짜아오 이성경이 주인공남자위해 연기이겠지 하고봤는데 하
6,의견쓰는건 좋은데 너무 막말들이 난무하네...
10,유해진 형님이 감독인가요?
10,감동영화 훈훈합니다 가족영화
1,응 이건 진짜 여러모로 토나오게해.
1,감독의 아가리를 찢어버리고 싶은 영화....
1,재미가 마이너스네..즉 역겹다...유해진이 잘하는 연기는 악역근처에서 찾아보길...주연으론 좀 아니 많이 딸린다
10,난 재밌게 봤는데 왜지ㅋㅋㅋ
7,황우슬혜때문에 7점줌 개웃기다ㅋㅋ 분량아쉬움ㅋㅋㅋ 막판에 오정세 까메오 잘어울림ㅋㅋㅋ 여 솨한편갑시당
6,ㅋㅋㅋ애들데리고볼만은했답니다
8,그냥저냥그냥저냥그냥저냥
10,영화는 항상 즐겁다. 재미있게 보았습니다
5,차라리 여자애랑 결혼하면 더 재미있을꺼 같은데..
1,개떡같은 영화 유해진 믿고 봤는데아들친구랑 러브라인은 왜 넣은거냐ㅡㅡ보지마세요 후회합니다
1,진짜 산으로 가는영화.. 다른 뻔한 영화랑 차별화를 둔것 같은데 너무 무리수를 둔것 같다..
5,유해진 이라는 배우를 좀 더 큰 그릇에 담아주었으면 한다
8,평점이  왜이럴까요? ㅜㅜ나름  잼있게 봤습니다~잔잔하지만  지루하지 않고~~웃음코드도  있구요~~해진씨는  여전히  친근하고~~주관적이지만 후회할 만큼의 수준은 아닙니다
2,유해진이라는 배우를 이런 저급한 영화에 출연시키다니...
8,유해진은 이런 캐릭터가 딱이지
10,최악임.. 이건 뭐..뭔 장르의 영화인지...
8,부모의 삶과 가족 많은 것을 생각하게 하는 대사들이 많았다.
1,영화제목이 레슬러길래 레슬러에 대한 내용 나올줄알았는데 거의 가족영화네 이럴거면 가족이라 제목짖지 어떤내용인지 모르겠네
4,시간 놓쳐서 못봤는데 잘된듯..
1,예전 MBC베스트극장이 이것보다 잼났다...
6,음...하... 음...응...그래...
1,내인생 OOO기 영화 이딴것도 영화라고 만들다니 영화 콜오브듀티는(이것도 천하의개막장임) 헛웃음이라도 났는데 ㅎㅎ 개저질영화 리얼은 양반이네
6,그냥저냥 볼만하내ㅔ요
1,초중반은나름 소소하게 재밌다고 생각했으나 술처먹고 우리아빠 영계조아함 ㅇㅈㄹ 하고 아빠 멱살잡고 개 패륜짓 역겨워서 꺼버림
10,염력이랑 팔씨름 그 뒤에 봐서 그런지 훈훈하고 재밌었음
8,부모님과 재밌게 잘봤어요
8,그냥 가볍게 웃으면서 봤어요
10,저는 정말 재미있게 감상했습니다. 결국 사랑은 이루어지지 않았고 그 감정들이 공감이 가서 마음이 아프네요 그리고 유해진씨 아버지 연기 굉장히 잘 어울렸습니다. 두 부자가 링 위에서 치고받고 울며 사과하는 모습 보면서...
2,누가 작가인지  -100어이  없슴.
6,납득하기 어려운 결승장면부터의 오분을 뺀다면  7.5
1,"유해진, 나문희, 성동일 등의 명배우들을 캐스팅하고도 영화를 이렇게밖에 못 만드나?? 이것은 완벽한 시나리오의 실패!!내가 최근 본 한국영화 중 가장 쓰레기!!마동석의 챔피언과는 너무나 대조적이다!!평점에 0점이 없..."
10,재미가 매우 좋았슴 적극추천함
1,진짜 최악키쿠커카ㅋㅋㅋ
10,영화가 주는 메시지는 간단합니다.부모는 아이의 삶을 위해 채찍질을 하지만 아이의 목소리는 듣지 않는다. 부모는 아이가 원해서 한다고 생각하지만 아이는 사육당하는 돼지로 생각한다.당신의 자녀와 당신은 얼마나 많은 이야...
8,유해진씨 연기 정말 좋았음이성경이 미스임 연기는 잘했지만 조금 나왔어야아빠와 아들 얘기임
10,재밌다ㅎㅎ  딸뻘 여자 좋아ㅎㅎㅎㅎ
2,미친 패륜아 새끼 이 영화본거 레알로 후회한다
1,이거 안본 눈 삽니다....
1,노잼이고 더럽기까지 함
1,캐스팅 저렇게하고 무슨내용인지..
1,돈 내고 봤던 사람들은 얼마나 빡쳤을까? 인생 쓰레기 영화
6,그냥저냥 영화관에서 보기에는 돈아까움
6,재미있게 잘 봤어용~~
8,감동적인 영화인가 하고 생각하면서 봤는데. 엉뚱한 러브라인때문에 상상이상으로 재미있게 보았네요
1,역대 유해진 나온 영화 중 가장 재미없다
10,몰입하며 재밌게봤어요마지막에 눈물이 고이더라고요
1,억지 끝판왕 모든게 억지
8,재밌어요 배우들 앞으로가 기대됩니다
1,ㅋㅋㅋㅋ돈이너무아깝다
8,ㅋㅋㅋㅋ조금 아쉬운 점들이있지만 캐릭터를 잘 만들었고 (물론  못살렸지만 . . .) 유해진이랑 러브라인을 만들어서 욕을 먹는게 나로선 나름 꿀잼이다
1,1점도 아까운듯 코미디 인데  내용이... 아저씨를 사랑하는 20대여자?
1,이성경이랑 결혼했으면 8점짜리 영환데 아들이랑 결혼해서 1점
2,설정이 욕나옴..아들이 무슨 여자하나때문에 저리 되냐?..일부로 저러기도 힘들겠다..
1,"정말 말도 안되는 시나리오..아빠뻘 아저씨를 사랑한다는 설정은  뜬금없는..이거 볼 시간 있으면 인도영화 ""당갈""을 보세요. 같은 소재(?) 지만 하늘과 땅차이입니다."
10,보면서 울었다 정말 너무 깊은 영화였다
2,무엇을 말하려는지..보는 내내 불편했던
1,이런 제길.... 엉망임
1,이게뭐야 영화맞아? 에혀
10,집에서 봤는데 너무 재밌게 잘 봤어요~!
10,꿈과 사랑이 있는영화. 흥미있게보맜읍습니다..
6,딸같은 20살 연하 여자애가 들이대는 설정이 불편하신분들이 많네요. 설정을 제외한 연기나 화면같은 나머지는 그럭저럭 시간때우기용으로는 괜찮습니다.
1,이게 영화야? 아니 무슨생각으로 저걸 영화로만들지?
1,유해진의 매력만 인증~ 가족애는 막장으로~
1,감독은 무슨 생각으로 이런 영화를 안든걸까?  그리고 제목은 왜 레슬러냐 그냥 주인공 직업이라서? 참 답없는 3류영화 킬링타임도 안됀다
7,"제목을 잘못지은듯,,,,나름 잼있게봤유~~"
10,잔잔하면서 주변에서 쉽게 볼 수 있는 이웃 이야기지만 공감과 많은 감동으로 가슴 뭉클하게 합니다.가벼운 이야기 같지만 부모와 자녀간에 충분히 있을 수 있으며 서로 잘 하려는 넘치는 마음이 눈시울을 적십니다.관객수가 ...
1,이런  영화가 폭망해야 한국영화의 발전이 옵니다
2,아재들의 환타지...
10,보지마세요 진심입니다
10,저는 재밌게봤습니다 저희엄마랑똑같아요 ㅎㅎ
1,비급 아니고 씨급 영화 소재와 줄거리 / 부자관계에 얽매이지 말고 각자의 삶을 살자는 건 알겠는데 공감 안되는 (토나오는) 러브 스토리가 90프로 이상 지배
1,할말을 잃음..요 ㅠㅠ
1,누구머리에서 나온 발상이고 대본인지.. 영화적 재미도 너무 없고 대사가 정말 기가찬다.. tv에서 무료로 보여줘도 시간 아까운 영화..
6,나는 재미있던데....
4,유해진 덕분에 그나마 웃었습니다.
3,벌릴 시간있으면 적당하다.
10,믿고보는유해진!!!강력추천
1,꼴값지 않는 영화... 설정부터 부담스럽고 보기가 매우 불편했다 ...이런걸 영화라고 만든건가 싶다
1,왠만하면 욕은 안하겠는데. 이걸 영화라고만든 감독. 배우. 작가. 투자자. 영화사. 전부 OOO라 !!!
1,제 3의 클레오파트라인듯
1,이건 뭐 아침드라마 개막장 스토리도 아니고 아오 짜증
1,유해진 때문에 봤는데..진짜 인간적으로 너무 했다이렇게 노잼일수가 없다 배우들이 아깝다
1,진짜 이딴 영화 만들지마라 보다가 역겹고 토나오고 뭔 스토리인지 하나도 모르겠고 그냥 이 영화볼바에 수학공부를 더해 미띤놈들아
3,으랏차차 스모부까지 기대하지도 않았다. 그저  레슬링 이라는 스포츠 소재에  한국이 잘해왔던  로코물을 잘 비비길 기대했건만  사랑과 전쟁에 나올법한  막장 코드라니...   이성경의 매력만 보인다
2,우와...여자하나가 사이좋던 부자 분탕질 해놓고 유학..부자간 싸우다가 극적으로 화해~우정?찾는 영화...기가막힘~이성경이 이뻐서2점 준다.
10,진짜 재밌습니다 보세요 ㅜㅜㅜㅠ꿀잼 감동영화입니다♥♥
5,장모님이 예고편을 엄청 맛깔나게 봤는지 계속 보고싶다고 하셔서 ip티비로 유료로 보게됐다...네이버 평점을 보고 끝까지 안볼려고 했지만 장모님께 효도하는셈 치고 봤다...결국 불효를 하고 말았네...나도..마누라도....
5,극장가서 본 관람객들이 불쌍해지는 영화.
1,내인생 최악의 영화 내용에서도 그렇고 시간도 아까워 넘 화난다
6,그냥 가볍게.. 딴 짓하면서도 봐도 됨..
10,코미디영화에서 멀찾으려고하지마 ㅉㅉㅉ 걍 아무생각없이 보고 웃으면될일을 ㅉㅉ
1,참 할말이 없게 만드는 영화네요ㅡㅡ^
10,유해진은 믿고본다요.소소한 느낌의영화!좋아좋아
1,하...전개도 없고 불효영화에 정말...하
1,무료영화로 떠서 봤는데..공짠데도 열받네
4,?!?!jQuery22406909684663683782_1530970122802?!!?!?! 무엇
10,에jQuery2240005321697820712901_1530961517924 왤케 평점이 낮아요 ..?ㄴㄴ여러분 제발 저분들 말 믿고 안보려 하지마시고요 제말믿고 꼭 보세요완전 강추해드립니다!! 강추강추
10,재미진다 역시 유해진 연기 찰지다
10,"댓글 평점을 주욱 보니, 또 어느 집단의 테러가 있었는지 알겠다. 영화 너무 즐겁게 보고 그 반응이 궁금해 들어왔는데 안타깝네요. 순수한 마음과 부모님의 사랑을 느끼며 영화 보는 내내 설레기도 뭉클하기도 했습니다."
2,진짜 궁금해서 그러는데 그래서 이선경은 누구랑 결혼한거에요jQuery22407600588141516533_1530887317973 막판에 나문희가 사돈이네 어쩌네 이선경네   꼬맹이가 이모라 불러보라 어쩌네 설마 귀...
7,내용도괜찬고 감동적이네요~
10,나는너무재밌었는데....;;
8,역시 유해진은 유해진이었습니다
4,그닥 재미있지느않았습니더..
1,더럽게 재미 없네  진짜..ㅎㅎ 스토리도 없고..
1,진짜 어이가 없다... 뭐 이딴걸 영화로 만들었냐
