score,review
1,77만명한데 안미안하냐? 참 감독등.배우등 미안함을 조금이라도 느낀다면 소주사라
6,막장 스토리 킬링타임용솔직히 키포인트는 선 자리의 닥터이다. 매력쩔던데.
1,가영이가 넘나이기적이쥬
1,감독하기 참 쉽네 똥망 그 자체.
10,
7,아버지 뻘의 남자를 좋아하는 젊은 여성의 모습이 신기하면서도 귀엽다. 레슬링은 곁가지이고 이런 꽁냥꽁냥하고 아기자기한 로맨틱 스토리가 예상 밖이지만 웃긴 대목들이 꽤 있음.
10,저는 재밌게 봤습니다. 추천합니다.
4,연기파 배우에 비해 스토리가~~
10,"6점대 영화는 아니예요,,잼있어요~!!"
1,이성경때문에 봤다가 진짜 ㅈ같다
8,성별이 바뀌었다면 1점준 인간들 8점~이상 줬을 듯 ㅋㅋ
1,"김민재 팬이라서 보긴 봤는데 내용이 넘 역겹다. 엄마와 사랑이라는 단어가 이렇게 역겨울 수 있구나 생각 들었음. 이성경 입에서 엄마, 사랑 단어 나올때마다 소름."
10,난 재미있던데 난 재미있던데
1,오줌보다 못한 영화..
6,배우들 연기 잘함. 스토리가 미국영화급인데..블랙코미디인가싶을정도로  우리나라정서에는 아직어색한  이야기.
7,배우들 연기는 좋은데 내용은 그닥...
2,억지 감동 웃음 뭐하나 자연스럽게 흘러가는게 없음
2,하 이건 뭐 이도저도 아니고… 그냥 고구마100개먹고 텁텁하고 느끼하니까 더 느끼하게 계란노른자까지 추가한느낌임
8,평점이 너무 악플같아  보여서... 나름 재밌게 킬링타임용으로 볼만했어요 근데 평점이  심한 악플수준이 너무 이해안되서
10,재밌게잘봣어요~~~~
5,솔직히 1~2점짜리는 아닌 것 같은데
3,캐스팅도 좋고 연기도 좋은데 왜... 감독이 문제인지 시나리오가 문제인지ㅜㅜ
10,8~9점 주려다 네이버평점이 너무 낮아서 10점했습니다. 주연 조연 배우분들 연기 다 잘 하시고  스토리가 재미도 있고 나쁘지 않았습니다.
2,이웃어린애가 짝사랑하는걸 갖구 주인공(유해진)을  같이  몰아가면서 일 크게 벌이는  말도 안되는 스토리를 보는 관객의 입장에서 납득이  되질 않네요.지금까지 본 영화중에서  별하나라도 주기 아까울 정도라고 볼수있다...
6,유해진 얼굴에  아들 이쁜 여친이 좋아하는것도 그렇고 선나가는데 추리닝 입고나가서 황우슬혜 가 좋아하는것도 그렇고 정말  이입안된다.... ㅋㅋㅋ 정우성이나 원빈이면 이해하는데 이건 유해진이 제작한 영화라는 생각밖에...
9,좋기만 한데 평점 너무 낮네요영화는 영화로
1,뭔가 감동적인 내용을 전달하려고 했다면 대 실패임.... 소재 자체가 너무 보기 불편하고 그렇다고 분위기가 밝은 영화도아님 공짜로 보라고해도 안볼거같네요ㅉ
1,개빡쳤음 보다가 뛰어나갈뻔
8,"모자간, 부자간, 우정간의 성장스토리"
8,"평점 낮아서 안봤었는데..   충분히 볼만하네요  ..  와이프  의사녀 아들친구의 딸..    ㄷㄷ     영화같은 삶을 살고 싶다던 말이 떠오르던데 딱 그렇구만요..    ""아저씨.   제가 열살이되면 아..."
4,"부자 사이의 다툼, 삼각관계, 노총각 연애 등 다양한 설정이 등장하지만 제대로 다루고 있는 것은 없다. 생각만큼 웃긴 장면은 없고, 갈등은 어이없을 정도로 편리하게 해결된다."
6,아들이 넘 싸가지 없네~
10,생각보다 평점이 낮넹ㅎ.
1,막장드라마입니다.이성경과유해진 러브스토리 재미없어요
10,애새끼들 잘확인했어야지
8,"배우들 연기도 좋고, 여러 번 울컥하기도 하고 많이 웃은 영화. 레슬링 씬도 실감나고 재미있어요"
1,"시종 일관 피곤하고 짜증스럽게 하는 영화. 말도 안되는 설정과 개연성, 출연진은 오로지 소리 빽빽지르며 자기 소리만 하고 있음. 이걸 온가족이 모여보는 해피영화라고? 정말 암걸리는 영화. 공짜로도 틀어주지 않았으면 ..."
8,가볍게 웃기 좋은 영화  자연스러운 연기  재밌어요
7,
7,영화는 그럭저럭이지만 유해진은 정말 다양한 캐릭터 연기를 소화할수 있는 몇 안되는 연기자인듯
10,
4,유해진이 맡으니깐 솔직히 남자관객인 나도 몰입이 안됨. 현실이라고 느껴지질 않음.
10,저는 너무 잼있게 봤는데 제목은 정말 아니네요제목만 내용이랑 연계됐어도 더 좋았을듯
8,잔잔한 드라마와 살짝 개그를 얹은 나쁘지 않은 영화. 큰 기대없이 혼자 시간 때우며 보기 좋음.. 나름 부모 자식 관계나 인생에 대해서 생각해볼 부분도 있는 영화인데 아쉬운 점이라면 마무리가 약간은 약하지 않았나.....
1,체육관 아저씨가 원빈이면 인정하겠다구여.조인성이나 공유면 인정을 하겠다구여 제가~!~!~!~!!@!!!! thㅣ부럴진짜 감독 사상 쥰내 궁금하네 진쯔
4,출연 배우들에 비해 내용이 너무 그렇네요.
5,코믹영화라기엔 부족하고...아버지와 아들의 감동적인 스토리라고 하기에도 좀 부족하고 ... 사랑...멜로는 아니고... 스읍 이도저도아니라 아쉽
1,
1,성경 언니랑 유해진 배우님은 대체 왜 이런 여와 선택 하신거에요???
10,재미있는데..?평점이 왜이러지...개인적으로 스토리 유머 다 너무 좋음
6,최근에 본건데 정말 재밌었어요 여기 평점이 다 별로 같은데 저는 럭키가 노잼이었어요
8,전 재밌던제요....
1,그렇게 낳지않던 치질이 낳았습니다
8,유해진씨의  럭키를 잼있게 보구  넷플릭스에  유해진씨 주인공인 영화를  다시 한번 기대를 가지구 보게됬는데~ 아주 유쾌하게 잼있게 봤습니다~ 배우들의 연기도  너무나  좋았구   스토리도 역시 소소하면서 위트가 넘...
9,끝까지 재미있게 보았습니다.
10,저는 개인적으로 울다가 웃다가 하면서 재밌게 봤어요 ㅎㅎ
6,휴...중년아저씨가 공유면 괜찮고 유해진이면 안되는구나. 김희애 유아인은 되고 유해진 정성경은 안되네. 그만저만한 킬링타임용 영환데 이중잣대로 깎아내리네.
10,레슬러  재미있고 추전도 하고 또 볼가 하고 있어요.
1,감독아 변태같은 판타지 영화에라도 구현하고싶었냐 가영이 20살인데 친구아빠를 좋아해서 레슬링을 배우고 설정진짜 더럽다 김민재 보려다가 별 거지같은 스토리때문에 기분만 개더러움남자 세끼들아 왜 가족무비같으면 딸 여동생...
1,ㅆㄹㄱ이딴건거르세요
8,코미디와 감동 영화가 잘드러나는 영화에요 정말 재밌어요 출연진 분들도 연기 정말 잘하셨고 심심하고 지루할데 이영화 보면 꿀잼 일것 같네요.
8,인기스포츠는 아니지만 내용이있네여ㅎ
1,진짜 개노잼 이배우들 가지고 이딴걸 만드냐 작가는 참 생각이 있는지없는지 1점도 아깝다 돈도버리고 시간도버리고
1,5000원 주고 본 거 아직도 돈 아까워요..
1,한국 영화의 단점만 모아 만듬
10,페미들의 억까 너무 역겹고엄정화 박서준 나온 드라마는 좋다고 육수흘리는것들이ㅋㅋ사회의 암적인 존재만도 못한 페미는 폐기가답입니다
1,가볍게 즐길 수 있는 가족영화로 생각했는데 이걸 못피했네
10,욕들이 많네요 김민재 팬이라서 최근에 봤는데 김민재 연기너무 잘하고 나머지 배우분들도 연기 너무 잘하고 나름 재밌게 봤는데
8,평론가들 납셨네요 보기 좋은영홥니다.스토리가 특이하긴한데 그게 무슨상관일까요...어쨌든 감동적인영화네요.
8,집에서 가볍게 보기에 나쁘지 않아요.
10,아들과 같이 다시보고  싶네요. 재밋습니다.
10,결말이 없어서 아쉽네요..지루하지 않고 잘봣는데..
7,"이 영화는 보여지는 내용, 소재와 다르게 어른으로 성장하는 과정과 가족과의 관계를 보여주려 한것 같은데 후반부의 개연성이 떨어지고 스토리가 빨라지는등 다소 아쉬운 면이 있었다. 또한 우리나라 정서(?)와는 다르게 영..."
3,되도 않는 억지 감동을 노린 것 같은데 그마저도 1도 없음제작자는 유해진한테 미안하지도 않나?
9,그저 1점짜리 영화는 아닌것같다가볍지만 스쳐가는 무거움이 있는듯평점테러가 많은것같아서.. 근데 10점주긴 좀 그렇긴함
10,영화도 안 보고 댓글로 별점 테러하는 사람이 많네요.스토리에서 이성경이 유해진 좋아하는 건 전체중에 일부입니다.그 스토리가 주가 아닌데.. 다들 쿵쾅이들한테 당해서ㅠ전 모처럼 좋은 가족 영화를 봤네요. 별점 테러 때...
2,감독님미안합니다 찍으신 거 다 좋아하는데이건 정말 쉴드를;;; 해줄 수가 없어요 크학
6,음... 유해진을 진짜 좋아해서 봤는데 좀 음 스토리도 별로고 코믹으로 갈거면 아예 코믹으로 가던가ㅠㅠ 유해진만 아니었으면 1점짜리인데 유해진이라 3점 더 줍니다.. 유해진 이런 작품은 하지 말아요ㅠㅠㅋㅋ 믿고보는 ...
10,"재밌는데.. 나이 차이 나는사람 좋아할수도있는거구, 연기들도 잘하고 웃가기도 하고, 여자 기준에 대한 얘기는 맞선내용 반대로 말한거고!"
8,
3,명배우들 갖고 뭐하는거여... 학교에서 잘 모르고 틀어줬는데 갑분싸됨ㅠㅠ
2,이성경때매 참고 봤다 진짜 ㅋㅋㅋ
3,온가족을 위한 해피무비라 해서 믿었잖아 스크린 이 OOO들아
8,
4,지금 넷플릭스에서 봤는데 솔직히 뭔 설명도 없고....뭔 뭐 좋아하게 된 이유도 안나오고 개연성도 없고 뭔....솔직히 그냥 그저 그런 영화...뭐 페미가 까건 뭘하건 솔직히 당갈이었나?? 그당시에 그거 봤으면 아무...
10,평점테러 왜그런가 했드만 메갈들이 평점 테러 한거구나 ㅉㅉ
10,영화좋습니다. 별점테러하시는 분들은 영화를 보긴 하신건지 모르겠어요. 저분들 딱 말씀하시는 내용이 그냥 예고편 내용밖에 안되요. 실제로 영화봐보면 그런 이상한 내용 아니구요. 시간내서 보기 충분할정도로 재밌고 감동있...
10,재미도있고 감동도있어요ㅜㅜ겁나 울엇어요ㅜㅜ
1,1년에 한번씩 학교에서 단체로 영화관람하는 날이 있는데 유해진 나온다길래 대부분 레슬러 봤다가 분싸분싸갑분싸...
10,전형적인 페미들이 싫어할 영화 킬링타임으로 충분한 영화이다 머리 길고 치마 얘기는 황우슬혜 반대대는걸 얘기한건데 눈치가 없으면 영화를 보질말자
1,OOO기 영화 이성경 몸매만 이뻤다
1,한남 판타지 실현 영화. 보면서 진짜 어이없는 웃음도 안 나오고 불쾌하기만 했음
10,그냥저냥... 한 7.5점정도가 적당한듯.  아줌마들 평점테러한거 꼴보기싫어서 10점
10,재밌는데 ..  유해진은 말고 김민재 &이성경의 사랑이야기이게 맞는거죠
10,"엄마랑 함께 봤는데 가족영화로써 제격이네요. 공감도 되고 따뜻하고 재미도 있어요. 야한야채는 버섯~ㅋㅋㅋ 야재개그도 재밌네요 단순한 오락영화, 레슬러 이런거 기대하거나 가족간에 공감이 잘 안되시면 재미없게 느끼실수있..."
1,진짜 극장에서 안본게 신의 한수다.
6,생활관 사람들끼ㅣㄹ 모여 이영화를 봤던게 기억이 난다 만약에 영화관에서 봤다면 중간에 나왔겠지?? 정말 티비에서 틀어주면 한번쯤은 시간때우기에 적절한 영화
10,진짜 크게 웃어네요우울할때보면 대박 웃낌~~^^♡
10,추석 특선영화로 봤는데 재밌구만
8,"돈주고  보기는 아깝지만 단편 드라마라고 생각하고 보니 그런대로 재미있네요. 하품은 계속나오네,오늘은 푹 자겠네요.  고맙습니다."
10,덕분에 불면증 해결 됬네요 감사합니다^^
1,아들 캐스팅 망한듯...
1,명절에 이걸 티비에서 틀어주네 미친ㅋㅋㅋㅋ
10,폐경 앞둔 늙은 비수컷들이 평점테러해서 10점 준다 ㅋㅋ
1,유해진이 찍은 영화 중 최악
1,스토리 최악그자체임.
10,점수 왜 이러나 봤더니...
2,보고나서 멘탈 털림...
1,한국식 바보같은 여주의 바보같은 사랑이야기
10,그래두 유해진 연기는 좋아쑴...ㅇ.ㅇ
2,개진상 영화. 감독아 작가야 다신 영화하지마라. 니네가 영화만들면 사기치는거야.
1,시간이 아깝다....ㅋ
6,메갈들 테러 오지네 ㅋ임수정 장기용 연애하는 드라마는 그리 물고빨면서~근데 제목은 솔직히 잘못정한듯
2,여진구 때문에 봅니다..
1,인도 영화 당갈  보고 이영화를 보았다.
1,구데기입니다....
1,솔직하게 말해서 염력이 이것보다는 그나마 재밌었다
1,제목이랑 내용이 따로 노는 영화. 1점도 아까운 영화. 감독이 전하고자하는 메세지가 뭔지 파악하기 어렵다.
1,여사친이 아빠를 사랑한다는 설정부터 개구림
10,황우슬혜의 재발견. 배우들의 재능을 이끌어내는 감독. 참신한 소재.
3,남자애가 너무 불쌍하다..
9,재밋는뎈ㅋㅋㅋ 성동일 맥주들고 있는게 너무 웃김ㅋㅋㅋㅋ
8,시선강간 장면과 자고로 여자는 ~ 해야한다. 이런 개소리 대사만 없으면 나름 괜찮은 영화
10,난 알바아니고 겁나재밌게봤는데.. 앞으로 평점 낮아도 믿으면 안되것음내가 눈이 낮아서 그런가봄
4,유해진과 이성경의 로맨스는 재밌었지만 김민재의 짜증유발 힘들었다.
1,머지이건...  약빨고만들었나
1,안봤는데 볼까하고 평점 보러왔는데 평점이 재밌다 ㅋㅋ
2,배우들은 모두 훌륭했으나 내용이 다말아먹은 영화 그나마 배우 덕에 끝까지봤다
7,투자:유해진 포상:유해진
10,넷플릭스서 보고 평점 왜 이러나 했더니 20살 여자가 40살 유해진 좋아한다고 테러당한거였음.. 10대 고딩이 40살 라미란 좋아하는 내안에 그놈과는 평점 분위기 완전 다름
1,살면서 처음 평점 남겨본다.넷x릭스 에서 배우들만보고 틀었다가야동에서나 나올법한 러브라인 보고 어이가없어서 네이버 평점 보러왔더니 아니나다를까 다들 같은생각들이시네내인생 역대급 노답 영화.끝까지 볼필요도없다이건
9,재밌어요. 만화 같은 뭐 그런 맛이 있어요. 유해진님이 좋앙
1,죄송한데 진짜 재미없었어요...
1,제목만보고 한국판 당갈을 기대한 내가 바보지...
1,내가 웬만하면 평점 5점은주는데... 이건 좀.. 너무 심했어.
2,쓸데없는 신파극!! 잘가다 실망스러움
1,노잼. 감동도없고 재미도없고 노진구 패륜연기 잘봤습니다
1,너무 별로라 할 말도 없다.
10,"페미들에게 저격당한 영화 ,...ㅠㅠㅠ 불쌍.... 평점보소  극한직업보다 재밌는데"
1,최악 딸같은 애랑 뭔 아저씨 로맨스;; 좀 역겨움
1,보다 말앗다 ㅋㅋㅋ 장난침???니 엄마가 될께???
2,뭐 이런 개 쓰레기 같은 영화가 다 있냐 티비로 보는데도 시간이 아깝다
10,가영 남사친 아빠 귀보 역할에 소지섭이거나 현빈이거나 원빈이었어도 그렇게 싫기만 했을까?결국 나이때문인것 같아도 유해진 외모를 비하하고 있는 꼴페미돼지새끼들이 아닌가...(딱함)남자들이 홍진영 언니 홍선영 외모 비하...
10,다시봐도 이벙헌감독의 띵작이네욤
10,시대 착오적이지만 좋은 시도
8,유해진 매력 있네. 정말로. 근데 엔딩이 뭔가요? 성경 아니 가영?이랑 결혼한 건가요??? 근데 왜 안 보이지?
1,딸 친구가 친구 아빠를 좋아하는 산으로 간 시나리오
10,평점 왜 이렇게 낮은 거니;; 연출 좋고 내용도 짜임새 있구만. 내 촉은 이 감독 언젠가 천만 영화 찍을 거임. 소재랑 스토리가 취향에 안 맞아서 재미없다고 할 수는 있지만 영화 자체는 감독이 의도한대로 원하는 목적...
7,충분히 보고 웃고 즐길만
1,이런걸 개봉하냐이거 이거 스토리 영화꺼리가 그케없나시간낭비
10,영화관에서는 못봤지만 뒤늦게 결제해서 본 영화인데 우리 부모님들의 마음을 느낀것 같았습니다.  정이 가득하고 유쾌한 영화여서 늦게라도 평점 남겨요~
10,젊고 싱그런 영화워터보이즈 같은 영화가 생각나네요.
7,그렇게 욕 먹을 만한 영화는 아니였다. 왜 이렇게 평점이 낮나 했더만 역시 개돼지페미들이 문제. 가축들 뇌가 살지고 평평해서 그런가 중간도 없이 하나같이 아이큐가 1이라고 말하고 싶은건지. 역시 예외없이 최악이라는 ...
8,이거 그냥 잼났는데 왜케 평점이 낮지
10,이성경 진짜 이쁘고 사랑스럽다ㅜㅜ
5,뻔~한영화. 처음부터 끝까지 너무 뻔해서 뻔뻔하다
1,사람들이 왜 이러는지 알겠다 하...
10,그냥 유해진 보려고 보는 영화랄까
2,22/4 도대체 뭘 보여줄라고 한걸까 유머도 웃기지도 않고 제목은 레슬러인데 이상한 러브 라인(유해진이 아니고 정우성같으면 납득이 가겠지만)을 집어 넣어...레슬링과 무슨 상관인거지
1,이딴것도 영화라고 돈주고 보는구나.나는 돈받고도 못보겠다 이런영화는..
10,잼있었어요 각배우들 연기가 자연스러웠음
9,믿고보는 유해진.재미있네^^
1,1점도 후 하게 준다.앞으로 한국영화는 돈주고안볼생각임.
3,레슬링 영화인줄 알았네요...
9,페미들 ㅂㄷ대는게 너무 안쓰럽다..
10,난 가볍게 봤는데 페미들이 싫어하겠네
1,제목은 왜 레슬러지...뭐지 이 개막장은아니 그리고 체육관에 여자가 오면 뭐시 그렇게 다 쳐다보고 그런 장면을 넣는거임?짱나네ㅡㅡ
7,걍 볼만했는데 왜케 평점이 낮을까하고 생각해보니 페미님들은 불편할 소재였네요~상황이랑 성별이 반대였다면 이거보다는 훨씬 좋은 평점이 나왔을듯..걍 그냥 킬링타임용 영화..
6,가족애를 그린 드라마인지 로맨틱 코미디인지 하나만 했어도... 토끼 두마리 다 놓쳐버린듯
8,남주가 유해진 아닌 장동건이었어도 평점1을 줬을까나? 볼만했당.
7,다시보기!  볼만하고 괜찮은데
1,이게 재밌다는 색히들은 외계인이냐?
10,존나재밌다 꼭봐라 쉬봘 나만죽을순없다
5,"각종 좋은 재료들로 밥을 비볐는데, 맛이 좀.."
1,짝사랑한 이선경이 잘못한거지 유해진 왜 가만히 있다가 봉변이진 모르겠다
10,10점은 아니지만 7점정도 되는듯 나름 볼만한 영화
1,처음으로 재미없다라는 감정을느끼게해준 영화
7,1 주는 인간들은 정말보고 주는거 맞는지 의심이 든다.무난하고 재미있었다. 스토리상의 와닿지 않는 부분이 있다고 하여 평점테러를 당하기엔 배우들의 사랑스런연기가너무아깝다. 최고의영화라 할순없어도 충분히 재미있는영화이...
4,전개는 개나 줘버렸다. 가끔 피식하긴 했다.
10,생각없이 볼만하구만..
10,재밌네요..ㅎㅎ 나한데도 저런일이 있었으면..ㅎㅎㅎ
10,재미있게 봤습니다. 평점 재조정 필요할 것 같네요. 탐정 시리즈보다 낫습니다.
10,페미새끼들 1점주는거 역겹노
1,밤에 잠 안와서 봤더니 좋네요 ㅎㅎ
1,왜 만들었는지 모를..정신나간 영화
8,난 볼만하던데. 재밌다고 느낌. 이성경?하고 결혼까지 했으면 별5개인데. 중간에 사라져서 붕뜨는 스토리. 밑에까는 애들은 주연이 장동건이면 별5개 줬을 애들.
6,예~ 그냥 그렇네요~~
10,난 웃낀다 우하하하하 비현실적인 드라마지만 난 이게 조으네.
1,베댓중에 명절에 틀지 말라고 했을텐데 명절에 틀었다
10,이성경 같은 20살이 저러면 아주 그냥 바로 그냥.
7,공감이 전혀 안될 정도로 말도 안되는 얘기임. 근데 하도 말도 안되서 궁금해서 끝까지 보게되는 영화 ㅋ 나름 난 신선하고 재밌게 봤음. 이성경 너무 이쁘다
6,자극적이지 않은 그저 무난한 가족 영화.
1,이런걸 영화라고 만드냐 내인생에서 제일 아까운 2시간이였다 중고등학생부가 만들어도 이거보단 잘만들겠다 어휴 토나온다 토나와
2,이성경과 결혼이 왜 안되는지 왜 지탄까지 받아야할 나쁜짓인지 이해가 안되네 남녀관계에 나이를 왜 들먹거려 서로 진심이고 사랑하면 나이가 무슨상관이라고 뻔뻔내용 뻔한 결과 뻔한 폭망이지
10,둘이 잘되기를 바랬는데.
2,쓰래기는 쓰래바퀴가 있어야지요아이들이 보면 불량해지는 영화절대로 배울점이 없는영화같아요죄송합니다 보다가 화가나서 그랬습니다
10,난 잼있던데;;  공짜로 봐서 그런가?
1,20살 차이 나는 커플 억지로 엮어놓고 거기에 대한 서사적 배경같은건 하나도 없고 배우들이 불쌍하다 진짜개그 포인트도 이상하고.. 돈안내고 티비에서 하는거 보는데 진짜 이걸 돈 내고 본 사람들이 불쌍함설날특집으로 이...
10,굿입니다 볼만하고이성경몸매밥도댁
4,이성경같은 새엄마를 원한다-어느 발칙한 아들!
1,아들이라는 놈이 뭐 이런 OO같은 놈이 있어... 뭐 이딴 걸 영화라고 만들어
1,데드풀2 보려고 관타기하다가 직원한테 걸려서 그냥 이거 봤는데 진짜 재미없었던 영화
6,유나이티드 탔더니 이 영화 들어있어서 어쩔수 없이 봤다. 12시간 비행이라 어쩔수 없었어 ㅠㅠ
1,무료로 보여줘도 안 볼 영화 ㅎ
6,나의 예상을 뛰어 넘은 희한한 작품
10,엄청 재밌고 최근 본 영화 중 가장 재밌어요!!!
8,볼만한데.평점이 넘 낮네
1,보자고 한 친구랑 연락 안 함
2,레슬링은 당갈이지..
10,기대없이 본 영화 이지만 보는내내 입가에 미소가 감돈다 잔잔한 감동과 유쾌한 영화 내 평점은 10점
1,영화가 망하면 배우들이 불쌍할 때가 있는데 이건 거의 꼴좋다 수준임ㅋㅋㅋ어떻게 이 대본을 보고 출연할 생각을 하냐 ...하
10,재미있게 잘 봤어요. 추천~
10,잘 봤습니다.감사합니다.
8,채널스크린인가? 오늘하길래 나름 재밌게 봤습니다 유해진 사별한 아내로 나오신분 출연배우엔 안나오시는데 아름다우시네요
8,내용이 훈훈한 가죽애가 느껴져 재미나게 봤어요.
8,유해진 부인 역으로 나온 여배우 누구냐? 아무리 조연이라도 무슨 뒷배경으로 들어와서 발연기냐. 회상 장면이나 병원 장면에서 흐름을 딱 끊어놓음. 유해진 부인 역할 말고 다른 연기자들은 연기 잘하네.
2,아무도 공감할 수 없는 이야기...
1,"29년살면서 본 어떤 영화보다도 역대급 쓰레기 영화. 마지막에 스크롤 올라올때쯤되면 이 영화를 만든 감독이 누군지, 이사람은 도대체 무슨 생각을 하고 사는지 궁금해진다죽을때까지 당당하게 말할수있을것같다 내인생 최악의..."
8,이 정도 평점까진 아닌데...? 재밌었음
8,가벼운 마음으로 재미있게 볼수있는 영환대 왜케 막말들을 해대는지원...
10,색안경 안 끼고 보면 좋다.
10,잼나는구만 ㅋ 유해진 역시 잼나
10,너무 재밌네요 시간가는줄 모르고 봣더니 웬걸 꿈이었네요 잘잤다
1,시간 아까운 영화...
1,"우리나라는 각본에 제일 투자를 안 하나봐요. 그냥 대충대충, 설렁설렁, 다듬지도 않고 고치지도 않고 적당히 대강대강 만드는게 트렌드 같아요"
10,평점이 너무 낮은걸 알고 봐서 그런지 생각보다 재밋게 봤어요. 평점 7.5정도 적당한 것 같음. (너무 낮아서 10점 드립니다. ㅋ) 내용의 개연성은 부족하지만 부모자식 관계에 대한 메시지가 좋았습니다!
1,"85분 정도 까지는 좀 황당하지만 유쾌한 설정과 연출이라 이 영화가 왜 그렇게까지 평점이 낮나 싶었다. 근데 딱 그 때부터 스토리가 ㄱ ㅐ ㄸㅗㅇ 같이 흘러 가길래, 이 영화 때문에라도 마이너스 별점이란 걸 만들어야..."
1,이런 영화가 어떻게 제작됐는지.. 참사 입니다..
9,킬링 타임요으로 충분히 괜찮다 평점 테러 하지마라
10,"재밌고 감동적이었어요!! 사랑과 가족에 대해서 공감도 많이 되고 출연하신 모든 배우님들 연기도 넘나 훌륭하고,  마음 따뜻하게 해주는 좋은 작품 만들어주셔서 감사합니다♡♡♡"
8,케이블에서  생각 없이 봤는데 볼만하네요 댓글들 처럼 유해진이 아들 친구와 연애 하는 내용은 아니고아들 친구가 좋아 한다고 고백하니 니 인생을 살라고 충고하는 내용뿐
8,남자 나이 40에 자식을 위해서만 뒷바라지만 하면서 살 순 없잖아 20년간 잘 키웠음 됐지.. 그나저나 가영이는 그냥 유학간겨? 아놔.. 파이팅이 아쉽네 ㅠㅠ
4,ㅋㅋ이걸 영화관에서 봤으면...ㄷㄷ
