score,review
1,"다들 뚫얋뀷이 무슨 뜻인지 아시나요? 그건말이죠,,,, 저도 잘 모릅니다. 이 영화가 그래요 ㅎㅎ"
2,이러지말자ㅜㅜ 재미가없엏다
1,이거 각색이 이병헌? 돈 많은가 보다. 투자총괄에다 어디 바람바람바람 같은 막장 드라마 같은 영화 만들고.. 한국영화 망신 시키지 말고 그냥 독립영화나  찍어라ㅏ.
2,이영화보고 암을고쳤어요!!일본야동에서나  나오는 스토리...차라리 일본 야동이 더 스토리있고 감동적이지!!
10,뭐가 재미없다는건지 ㅡㅡ
4,미안하다 유해진의 좌충우돌 연기도 구하지 못하는 영화가 있더라
4,"레슬링도 없고, 부정도 없고, 성장도 없고, 메시지도 없고, 감동도 없고... 어린 여배우와 로맨스를 찍고 싶어 안달난 유해진만 있더라. 제작자가 여성이면 뭐하나? 인문학이 결여되어 있는데..."
1,아들이 개막장 패륜아란 생각밖에 안드네
6,배우들이 연기를 잘해서 그나마 낫네요.인물들 관계가 너무 난해하고 좀 막장이게 별로네요.
8,저는 너무 재미있게 봤습니다. 현실과 동떨어진 내용이더라도 배우들의 연기력이 영화를 살렸네요. 아들과 아버지와의 갈등속에서 자리잡은 사랑이 절 울리고야 말았습니다.
4,이성경 풋풋하고 예쁘네~ 그래서 4점. 연출이 너무 유치해.
10,사람 바다 다르지만 기분좋은 영화 같아요
1,재미는 있었는데 스토리가 제목이랑 ㅈㄴ 관계없어서 1점주는 영화
6,평점..저 정도는 아닌데..
6,내가 보기에 이 시나리오를 쓴 사람은 어린 여자애가 자길 좋아해줬으면 하는 로망으로 글을 쓰다가 이런 걸로 영화 만들면 말 나올까봐 막판에 부성애로 살짝 방향을 튼 것 같은 느낌이 강하게 든다. 그래서그런지 죽도 밥...
1,쓰레기 막장 불륜 영화 보지마
10,결말이.... 막 유해진엄마가 미안하다하고...결혼하고 유학간건가jQuery22407793838014389489_1528276632902??대화가그렇던데 ㅡㅡ
10,재밌던데...자극적이지 않으면서 담백해서 전 좋았으여
8,다시 보고 싶을정도로 감동받았고 유해진씨 연기 정말 잘하시네요. 나문희씨는 우리 엄마같았어요. 등장인물 묘사도 훌륭했고 모처럼 자극적이지 않고 내 삶과 가까이 있는 인물들을 만난거같아 좋았습니다.
1,와 이거역대급이넼ㅋ 감독은 밑에서 부터  차근차근 단계적으로 배우고 영화를찍어라 연출도 역대급 내용도 역대급 이건 제작사에서 줄빳다 놔야함
4,킬링타임용 으로도 아까운 영화
10,유해진이 왜 주연으로진작에 안나왔을까한다 영화같지않은감이있지만 유해진의코믹함과 김민쟈연기도잘하고 황우슬혜똘끼가 너무귀엽다 ㅋㅋ 집에서 다운받아보면 볼만하네요
2,이걸로 유해진 배우님의 소망이 이루어졌다면 그걸로 만족합니다
8,생각보다 더 재미있어요~ 따뜻한 가족영화~^^
6,부자간의 반목과 화해에 대한 진부한 내용은 그렇다 쳐도...별 이상한 러브라인은 왜 넣은거냐?? 이 영화의 포인트가 뭐여 도대체...6점
7,이성경 캐릭터만 제외하면 내용 괜찮음
8,보는 내내 지루한 감을 주지않는다!! 둘이 서로 진정으로 좋아하는데 꼭 나이 차이가 죄가 될수 있을까에 대한 또 한번의 질문!! 우린 직접적인 피해를 주는것도 아닌데 주변인들의 시선을 너무 의식하며 살아간다!!
1,"보는내내 분노가 치미는 영화였다. 1점도 아깝다. 이 영화를 안 봤다면 당신은 현명했다. 진심으로 표 값 환불받고 싶다. 내용, 연출 정말 저급한 영화다. 좋은 배우들 데려다가 이렇게 엉망진창인 영화를 만들 수 있다..."
7,배우들 연기 좋고 중간중간 남자주인공의 심리를 특이한 카메라연출로 구성된 점이 기억에 남는다. 줄거리와 연출이 좀 늘어지는 면이 있으나 허당영화는 아니다.
6,엄마가 재미있게 보시고 왔다네여
2,황우슬혜만 가장 매력있는 캐릭터였다.키워준 아버지를 자기 기분나쁘다고 메다꽂고키워준 노모의 말은 한번도 들을려 하지않고자기의 감정만 중요해 세들어 사는 친구의 아버지를연모하고상식적으로 불편한 요소만 넣어두고억지감동을...
9,"착하고 뻔해도, 재미있고 따뜻해서 울다가 웃었네."
1,제발 보지마세요 ㅡㅡㅡㆍ
10,제목이 왜 레슬러지요?.. 주제는 무엇이며...ㅠ
4,건전한 스포츠영화를 상상했는데아들 친구가 친구아빠를 사랑하는 영화라니
2,그냥 아들 짝녀랑 아빠가 썸타는얘기임ㅎ
1,뭐 나름 괜찮았습니다  ㅋ
8,이성경이 너무 이뻐서 8점준다 진심 이성경만 보게되네
8,뻔한 스토리는 예상되었으나  젊은 감각의 코드가 곳곳에 들어가 있어 의외로 볼만하다.
10,황우슬혜는 치트키다. 예뻐...
10,재밋던데...? 그리고 그딸이좀 불쌍하게된듯?
8,"난 해피엔딩을 싫어한다. 인간은 꼭 행복해지기 위해 존재한다라는 걸 강박적으로 주입시키기 위한 도구라 생각하기 때문이다. 그럼에도 불구하고 이유있는 해피 엔딩은 참 좋아한다. 이 영화의 힘은 단순함과 착함, 시시콜콜..."
10,나름 재미있네요 평점이 낮아서 10점 드림니다
1,쓰레기 영화 그 자체다 우웩
10,이성경이 너무 이쁘고 재밌게 봤는데 이런 평점 테러는 아닌거 같아10점준다 노래도 너무 좋았다
1,이딴 식이니 요즘 한국 영화가 욕을 먹는 것이다 개판도 이런 개판이 없다
10,5~6점은 되는거같은데  한국영화 +1점해서 7점대까지도 나올 영화인데 역시 마블이라서...
1,진짜 내인생 최악의 영화였음 무슨느낌인지 모르겠는데 영화보는내내 거북한느낌이 들었음 어떤 재미없는 영화를 봐도 이런 느낌은 아니였는데
1,사람들 생각이 비슷하다는 걸 알아서 다행! 이 영화 너무 했다..ㅠ
1,만원의 행복ㄷ이 아닌 불행을 느낄수 있음...
1,아니 그래서 뭐 러브라인 중점을 뒀으면 이뤄지거나 해야 할것 아니야 갑자기 쌩둥맞게 유학이야 뭔
1,챔피언은 띵작 ㅇㅈ?ㅋㅋ
10,충무로 영웅 액션환타지 3부작 : 1. 클레멘타인 2. 영웅 : 샐러멘더의 비밀 3. 레슬러  3부작 종결작이므로 꼭 보세요. 절대 후회합니다.
4,나름 어이가없어  웃었다 ^^
10,레슬러 중간 소스가 분명 눈에 거슬릴순 있지만 악평하시는 분들 순수한 맘을 너무 잊고 사셨네요 내가 힘들 때 돌아 봐준 사람 그게 당신이어서 사랑을 생각했다 충분히 공감 되는 내용입니다 영화 한번 더 보시고 대사 곱...
10,심심할때 보기좋다ㅋㅋ
1,1점도 아깝긴 처음임 다른 의미로 대박
1,아니 뭐하나 확실하게 매듭지은게 없네...아들의 레슬링도...아빠의 사랑도....뭐하나 확실한게 없이 그냥 끝나버려서 감동도 없고...시원함도 없고....그냥 영화보는 내내 답답하기만 하네
8,모 내용이 이상하긴 했는데 ㅋㅋ난 그냥  모. 8점은 줄께 ㅋㅋㅋ 걍 킬링타임용으론 좋았음
1,이것도 영화라고... 펜싱영화였음 아빠를 칼로 찔러 죽였겠네
5,뭐냐 꼴페미들 평점테러냐 진짜 재미없는거냐
10,흠 ㅋㅋㅋ 나름 괜찮았는데 사람들 너무 기대하고 봐서 그런거 아닌가 싶다. 7점대는 되는거 같은데...꼬마가 재미지네...연출량이 너무 적어서 아쉽구만..여주 매력 엄청나네...남자는 여진구인줄 알고 봤는데...아니...
8,나만  재밌으면 되는거였나
1,와 진짜 ㅅ.ㅂ 집에서 만원결제했는데괜히 죄없는 배우들 혐오감생길려고한다.찝찝함에 잠도안오네 ㅅ.ㅂ
2,아들 ㅈㄴ 패버리고싶음 암걸림
1,결승전에서 유해진이랑 김민재의 쥰나 비현실적인 레슬링씬만 아니었어도 이 영화 중박은 했을거다....진짜 더럽게 억지스러웠다.
1,그냥 친구아빠 이렇게 19금해서 떡이라도 치던가 이대일이라도 하던가  이딴 영화를 쳐만드는 감독 새끼 대가리가 참 궁금하네
1,어떻게 하면 배우들을 바닥으로 내려 앉힐까 고민하며 만든 영화...아놔~~ㅆ
4,아들  짜증남 ㅋㅎ하핳ㄹ
10,재미져요 꼴페미 상폐년들 잃어버린 젊음에  ㅂㄷㅂㄷ 평점테러이니 개의치 말고 보세요 후회 안합니다  페미들은 사회 경제는 물론 문화계까지 좀 먹는 바이러스  들입니다.
2,영화는안봤지만 댓글이 더 재미있네요
9,정말 재밌게 봤습니다. 개봉시기가 참으로 안타까운 영화였네요. 한국에는 잘 없는 류의 영화라 너무 반가웠습니다. 이런 영화 많이 제작해주세요 ! 추천드립니다.
1,엉망진창입니다. 잼있는 배우들 나와서 왠만하면 좋게 봐주고 싶었는데 너무 심합니다..
1,집에서 다운받아 봤습니다....밥먹으면서 볼만함
10,전나름 좋았어요 해피앤딩
1,여사원들이랑 보면서 민망해 쥭는줄알앗다 감독님 변태jQuery22404120606113478352_1528105571582 유해진이 아내 꼬신거부터 이성경까지 멜로는 전부 이해안돤다
1,역재 최악이다 진짜차라리 곤지암이 .
6,이 영화의 씬스틸러는 성동일의 연기와 황우슬혜의 역활이네.
1,내가 이상한 사람인가  의심스러워서 평점 확인하러 왔는데  안심하고 갑니다~~
8,설정이 좋은건 아닌게 맞지만 그냥 나쁘지 않던뎅
1,유해진 팬인데 왠만함 볼려고 해는데 보다가 잠 결국 보는거 포기~
1,헌혈값 내놔 내놔내놔!
5,평점 낮은데는 이유가 있더라
4,돈주고 보기 아깝다는 생각을 다했는데 관객이 저 혼자 였다는 ㅋㅋㅋ
7,꼴페미들 풀발기하네 그냥 영화는영화로봐라ㅉㅉ
1,예고편만 봐도 재미없는거같은데 돈주고 보러간ㄴ들이 호구지 ㅋㅋ바보들아 영화보는눈이 그렇게 없냐 ㅉㅉ
10,재밌게 봤습니다 재밌었어요
4,"유해진이라는 배우만 보고 왔어요. 개연성 없슴, 재미 없음"
1,꼰대 영화가 넘쳐나는 요즘에도 이정도로 꼰대영화는 보기힘들겠네 돈내고 걸러야되는 감독을 알게된 기분이다 내용도 없고 교훈도 없고 늙은남자 판타지만 가득한 영화. 무료로 보여준다고해도 다시는 보고싶지않다
1,기분나쁜 영화 ... 어떻게 친구이빠랑 로맨스가되는지
4,제목이랑 부합도 안되고 재미도 없고
5,잼있게 잘 나가다가 .. 이상해지는 게 아쉽네요. ^%^
4,"왜... 아버지를 매트에 뒤집기로 꽂혀야 하나요.. 아들  여친도 아니고, 막장.. 개막장"
9,걸작은 아니지만 충분히 좋은 점수를 받을 수 있는 영화인데 평가가 지나침. '흥미로울 뿐' 인 소재를 제하고 나면 분명히 영화가 얘기하고자 하는 바가 보임. 이건 욕망의 투영과 또 욕망의 모방 사이에서...
1,참 보기 짜증나고 불편하고 어떻게 이런 개 쓰레기같은 내용을 연출했는지 이해가 안돼네 보는내내 불편했어요 아니 이걸 어떻게 제작할 생각을 했을까? 망하는데는 이유가 있구나 32년 평생 영화 평점 처음 남깁니다
1,"유해진연기는 볼만 했으나 우리나라 전형적인 쓰레기 영화..킬링타임도 안됨.;; 아버지와 아들간에 쓸데없는 다툼은 보는내내 불편했다..아들연기가 오바스러워 버릇없이 보이기도했음. 물론 보는시각에 따라 다르겠지만, 유해..."
5,의외의 인물 한 명이 영화를 살렸다.
10,영화 속의 한명 한명의 삶이 모두 주인공이라는 것. 그리고 그들 개인간의 복잡한 감정과 부모와 자식의 관계들이 주였지만 결국엔 보다 다양한 사랑의 모습들을 담아내려고 한 영화같다.개인적으로 순수한 사랑에 대해 생각해...
1,"유튜브 리뷰에선 이 영화가 ""리얼""보다  못한 역겨운 영화라더라"
1,난 도대체 뭘 본건지 모르겠다 욕도 안나오는 영화다 진짜 이게 뭐지 무슨 내용인지도 모르겠다
2,우찌 이렇게 만들기도 어렵겠다 재미도 감동도없고 짜증만나네~  중간에 졸려서 잠~ 마지막부분때 눈떴는데 또 짜증이 밀려옴
2,짜증나고 불편한 연애 영화가 계속 전개되다 결승정의 패륜 레슬링으로 아빠를 뒤집어 엎는 ...  인도 영화 당갈과 극과극의 영화네요. 당갈보고 눈물 나도록 감동적이었는데 이 영화보니 헛 웃음만...
1,똥싸고 밑안닦은 느낌이 뭔지 지대로 보여준다
8,그놈의 페미 20살나이차가어때서 이성경이 그냥 철없이 좋아한것도 아니고 대사에서 볼수있듯이 자신에대한 확신이있는걸보고 대단하다생각했다 마무리가 아쉽긴하지만 개인적으로 빵빵터지듯 웃으면서 가볍게볼수있는영화라 좋았음
10,7.5점은 되야 할거 같은데 평점이 낮아서 10점 준다.
10,재미있게 잘봤습니다~^^
10,김민재 유해진 이선경 캐미가 좋내요  화이팅
1,내가 프로불편러인가 생각햇는데 아니엿다 영화자체가 불편한것이엿다
1,최악 ㅋㅋ 에거.. 수준참
1,이딴 개 똥 쓰레기같은 영화는 또 처음보네...케이블에서 방송해도 보기 아까운영화다. 가족 영화? ㄴㄴ 그냥 각본부터 OOO기 똥망영화. 유해진 필모그래피에 큰 허점을 남겨준 영화
4,"감독이 사람 좋고, 인맥이 아주 좋은 듯..."
1,유해진 필모그래피 어캄? ㅠㅠ  영화 수 ㅡ 듄
8,"솔직히 영화의 구성은 엉망이었지만, 이상하게 공감되는 부분이 있어서 많이 울었네요. 잘 봤습니다."
1,상상신보고 토할뻔. 영화라지만 ㅋㅋㅋㅋ친구아빠..?ㅋㅋ 내가 친구면 뚝배기 깨고 인연 끊는다. 결승전 직전에 아빠랑 레슬링 장면은 또 뭐냐 어휴 아들도 친구도 극혐 막장
1,간만에 망작이네요. 무얼 말할려고 하는지 모르겠네.
9,나의 현주소 공감가는 부분이 참 많음 지금의 나의 해피버젼. 이 해피버젼이 되고 자품
1,이렇게 처만들고 우생순 관객수를 기대했겠지. 한심하다.
10,재밌는 영화 이번에도 유해진씨의 연기는 정말 재미있었고 이성경씨의 연기에도 반했어요
10,사십데 총각인 나에게 꿈과 희망을 준 영화
10,나만 당할순없지. 꼭봐라 두번봐라 세번봐라
2,집에서 8천원주고 결제하고 봤는데 완전 돈아갑따이런 쓰레기같은 소재로 영화를 만들다니영화제목부터 잘못된거 아닌가평점남기긴 또 처음이네
1,무엇을 말하고 싶었던 걸까. 잘 모르겠다. 초반에 연애 이야기 나오길래 전형적인 운동 영화구나라고 생각했더니 그게 주된 내용이었음. 근데 그걸 뭐하러 보여주는 건지를 잘 모르겠음. 나이 많은 남자를 사랑하는 건 잘못...
1,0.1도가까울거같은..  제작사님들 죄송요 ㅠㅠ 조금 심하네요
4,굳이 영화로 만들 필요가 있었나?
10,너무 웃기다는 오랜만에 웃엇다.ㅋㅋ
4,"무난하게 이어가다, 결론 없이 끝나는 영화. 그러곤... 왜 영화를 만들다 말았지? 주제가 뭐지??? 하며 영화 중반부에서 그냥 끝난 듯 한 느낌의 영화... 뭘까? 이 영화를 만든 이유는..."
8,이 영화보면서 시1288649뷸ㅋㅋㅋㅋ모르겠다
1,놀이공원에서부터 욕했다
4,재미 웃음 감동 영화라면 최소한 한가지는 있어야하는데요 안타까워요
1,도대체 무슨말이 하고싶은질 모르겠다 이것도 영화냐? 감독아! 니영화는 다신 안본다!
7,평점 악플들보고 애지간히 힘든 영환가 싶었는데. 평범한 따뜻한 영화였다고 생각함작품이다 이런건 아니지만 뭔가 진정한 작품만 있을수는 없지 이런 편한 영화를 보면서 힐링하는것도 좋은데...유해진영화는 럭키등등  마음편...
2,이성경 때문에 1점 이라도 준다
1,이거 재밌다고 하면 알바생
3,황우슬혜 골빈연기에 별점1추가
1,이런 류의 ^남성향^영화가 아직도 나오냐ㅋ; 배우들 좋아서 30분 보다가 진짜 못보겠어서 껐다 인물들을 죄다 서레기로 만들어놨네
1,차라리 도시어부 재방 보는게 낫겠다.
6,아버지랑 봤는데 음 그래요 보통
10,와 너무 재밌게 봤네요댓글에 악플이많은게 안타깝지만각자 취향이라는게있으니깐여아무튼 너무 재밌게 잘봤습니다~!!
2,3분에1만 볼만함 내돈 주고는 안봄
6,결승전에서 패륜아 같은 아들 느낌이 너무 들어서 순간 되게 짜증났네
1,영화이름이 왜 레슬러죠?.. 20살차이나는 아저씨랑 갓20대 사랑이야기가 .. 스토리도 저급이다.. 진짜 이런영화만든이유가 뭐냐?진짜..티비에도 나오지마라.. 혹여나 가족들이랑 이런영화볼까 겁난다...영화만들지 마소...
10,이거 보고 울었는데 평이 왜이래
10,평점 너무낮다..재밋음
1,적어도 근 몇년동안 이것보다 재미없던  영화를본적이 있었던가 싶네 대체 무슨 생각으로영화를 만든건지  내 시간 돌려달라
8,나만 괜찮게 본건가?난 소소하게 재밌었는데 ㅋㅋ소개팅녀 의사도 웃기고ㅋㅋ
2,이건 좀 심하다 이건 아니다
1,이딴 재활용 불가능한 영화에 10점준 댓글알바들아 니네가 승리자다
1,레슬링이나해라 ㅡㅡ  ;
8,개연성으로만 보지말고 부모자식간의 소통을다룬 영화같네요 적당히 즐기면서 볼만했어요 저는 어느정도 부모자식간의 공감도되고.. 평점 1점준 사람들은 단순히 재미로보려했던거같은데 그러신분들은 그냥 안보시는게좋겠네요
8,나쁘지 않았는데.. 20살차이를 럽라로 꼬는건 좀 아니였지만 재밌었음
1,진짜 1점은 안주는데 이건 1점 이상 줄수가없다
5,레슬링 영화인가 가족의 감동적인 영화인가
6,설정은 다소 무리. 아버지와 아들의 일과 공통분모가 레슬링 일뿐 이야기는 제목과 별 상관 없는것 같네요. 그렇다고 1점 테러를 받을 정도의 영화까지는 아니고 ... 그냥 6.5점 정도..
1,짤막짤막은 괜찮은데 전체 내용으로 보면 이게 무슨 내용인지 뭘 말할려고 하는건지
2,철없는 아들때문에 아주 내내 짜증답답함이 영화보면 고구마 200개먹는 느낌
1,0점없나요;;;; 끝까지 보기가 힘든건처음. 서울우유 영화인줄...
4,"어떤 시나리오 작가, 감독, 제작자, 투자가, 배우 등 이 모든 사람들이 이성경이랑 유해진의 러브라인을 보고 싶어 할거라고 생각해서 만든걸까.."
1,결국 한 여자의 잘못된 행실 때문에 운동선수가 국가의 대표가 되는 경기를 포기해야되고 부자지간에 폭력이 오고가고 이게 영화인지 막장 드라마인지 구분이 안간다. 감독은 무슨 이유로 이런 영화를 만든지 이해를 못하겠다....
1,클레멘타인이후 최악. 갈등구조도 해결도 쓰레기. 미친..
8,6점이 딱 맞아요~^^
1,집에서 보다꺼버림 내용이 참
1,감독님이 참바다씨 비디오 가지고있나보네여자친구랑보다 여자친구분 나가심
1,어지간한 b급영화는 참고 보는데 이건 아니다
1,뭐 이런 보다가 화나는 영화가 있지 이런걸 돈주고 보다니
1,유해진이 아까워요...내가 이걸 왜 봤을까나..도대체 주제가 먼지 모르겠네요...
2,어떻게 이런 시나리오로 영화를 만들수 있는거지? 캐스팅도 공감안가고 최악인영화
6,영화가 나아가려는 방향도 이해못한채무작정 까내리기만하는 전형적인댓글이 상당히 많네요대부분의 10대들이 실망해서올린거 같구요 킬링타임용 입니다
8,유해진과 김민재의 갈등이 너무 짜증남. 그리고 친구 딸이 아빠뻘 좋아한다는 것도 좀 그랬음. 우슬혜 이쁘고 의사인데 튕기는 것도 현실감 떨어짐. 그래도 마지막에 이성경 맘 접어서 다행이고 무엇보다 마지막 노래와 브금...
10,부자 간 사랑이 아름답네요. 결말이 아쉬웠지만 평점이 생각보다 낮아 올리고 갑니다.
6,그리 나쁘진 않았는데 아쉬운건 성웅이 라스트의 가족식사자리에서의 폭로를 후회 하거나 사과 하는 모습이 보고싶었는데...  아빠와의 레슬링 장면도 웬지 어색했고... 결말이 좀 만족스럽진 않다...
1,미키루크 ‘더 레슬러’ 같은 스토릴 기대했던 내가 잠시 미쳤었나 보다. 한국영화 진짜 문제 있다. 이런 쓰레기 영상물을 소비해주는건 죄악이다.
4,볼만한 영화 정도입니다
1,제발 영화 제되로 만들어 주세요
1,3류영화 꾸역꾸역보다가결국은 오프
1,"영화 잘 찍자, 내사랑 유해진까지 싫어지기 전에..."
8,귀엽구 재미있는 영화!!!
5,김성경만 이쁨 이렇게 만들지 마요 걍..
1,처음이에요영화보다 중간에 나온거요유해진씨 좋아하지만..안되겠더라구요 ..
8,아 아쉽네요 해피앤딩은 아닌듯. 둘이 잘되쓰면 좋았을텐데.현실적으론 어려운 얘기가 될테지만.
2,꾸역꾸역 집어넣은 듯 무의미한 캐릭터와 주제의 혼돈은 몹시 불편했다.
6,영화 속 이성경의 모습이 너무 귀엽고 이뻤어요..상황도 웃기고요 하지만 막판이 아쉬움을 넘어 뭥미여서 점수를 깍았습니다.
2,별로...기대하고 봤는데...뜬금없어요
1,뭔 영화냐 진짜 ㅡㅡ 0점 안되니ㅡㅡ
10,자아두라비느두두차미미자
4,영화내용과 제목은 상관없음. 성장을 표현한 도구일뿐. 재미는 없음. 웃긴 것도 없음. 멜로 영화도 아님. 유해진이라 본 영화 일뿐.
1,더럽다 진짜 배우들이 불쌍함
8,평점이 왜 다 1점대지?친구 아빠를 좋아하는 부분은 그냥 영화적요소의 한부분일 뿐이고 가족드라마 나름 잘 풀어낸거 같은데... 쓰레기로 치부 할 그런 영화는 절대 아님
5,중반까지는 재밌는데 후반으로 갈수록 이상해지네
2,제목이 왜 레슬러인 건지... ㅠ.ㅠ
5,유해진 나와서 믿고봤는데....ㅠ그냥 저냥 봤네요.
10,너무 재미있었어요.이런 영화 좋아요.따뜻하고 재미있는 한국 영화예요.
1,재미도없고 감동도없고...
1,스토리가 개연성이 없어요.. 이 영화로 하고싶은 말이 뭔가요?
3,이건 솔직히 많이 실망이다.. 솔직히 중반부까지는 걍 재미나게 봤는데 흐지부지 결말에 '이게 뭐지' 싶다.. 믿고보는 유해진 영화 속 흑역사가 될 듯
9,재밌던데 영화안본애들만 졸라게 까내
9,난 재미있던데 ㅎ 설정이 좀 황당해서 그렇지
1,"쿠폰에, 할인에, 심지어 내돈들여서 산 표도 아닌데... 돈 너무 아깝다..."
5,내용 다 떠나서 유해진 배우가 이 시나리오를 보고 하겠다고 한 사실이 믿기지가 않는다.
1,20OO년 최악의 영화 카악~퇫!!!
6,솔직히 밑에서 돈아깝다느니 화난다느니 깔  정도는 아니다 중간중간 황우슬혜 웃겨 디질뻔했구만 특히 병문안 왔을때! 마음 비우고 보면 볼만한 정도다 그래서 난 3점!
1,보는중인데 이게 뭔.개소리여...라고 생각했다가 해진이형 탑여배우의 남자였다. ... 휴..
2,이건 아니잖아 소재 참 신선하네
8,역시 유해진니의 연기는 과하지도 않고 자연스러움의 끝이네요..그냥 생활이신듯~~~덕분에 우리가족 유쾌했었습니다.
1,황우슬혜 캐릭터 빼고는 볼 게 없는 영화..  황당하고 역겹다..
8,결말 10분이좀 마무리가 그런게 그전까진 잼잇네요ㅎ
10,코메디영화에 스토리하고 제목에 뭐그리 집착하는지 모르겠네 재미만 있던데 그냥 생각없이 웃으면서 보기에는 충분히 괜찮은 영화입니다
8,너무재밌게시간가는줄모르고봤습니다이성경이랑유해진러브스토리는좀그렇지만뭐연애인은전부연하만나는데뭐가그리나쁘다고참견은참니들앞가림이나잘해라영화만재미있게봤고만
1,ㅋㅋ히어로물 안 좋아하는 나도 다신 돈 주고 한국영화 보기 싫어지게 만드네....
1,주내용은 20살 나이를 뛰어넘는 러브스토리인데 왜 결말이 이런거지;;; 그리고 속좁은 아들의 질투와 꼬였던 시퀀스가 엎어치기  한방으로 갑자기 다 긍정적으로 풀려버리는 기적을 보여주네; 대체 이런 시나리오 투자한 놈...
10,가볍게보기좋은영화내요 막장스토리도있지만 엄청 거북한정돈아니내요 훈훈합니다.이성경님은.점점더이뻐지시네 데뷔초보다.그리고역시 나문희선생님!!넘좋아요 건강하시고 영화랑tv에많이많이나와주세요~^^
1,나진짜 왠만하면 잼있게보는데 이거는 심했다
1,어떻게 하다보니..봐버렸다 .... 명품쌀로 만든밥에 똥을끼얹은듯한  참신함
8,난 이성경이 하는 행동이 예뻐서 재밌었다스토리는좀별로인듯
