score,review
1,영화를 보는 내가 한심하게 느껴졌다
10,딸뻘이랑 러브라인이라고 욕 쳐하는데 그러면 레옹은요? 저는 둘다 재미있게봣는데 왜그러세요 다른나라는 모든 사랑을 이해하고 레옹도 재미있고 다들 칭찬하는데 우리나라는 왜 대체 바라보는 시선이 그런가요? 저는 이 영화 ...
1,제목이 레슬러가 아니어야했다
10,생각보다 너무 재밌어서 끝까지 웃다 나왔급니다
8,나만 재밌나...ㅜㅜ인생은 나를 위해 사는 것이라는 교훈 얻고 갑니다..저는 참바다씨 출연영화는 다 좋아요 ㅜㅜ진짜 살면서 필요한 교훈 많이 얻었습니다 ㅜㅜ
2,좀 실망이네요제목을 어떤의미로
6,잔잔하고 훈훈합니다.
1,쓰레기 영화 불법다운 해서 보더라도 포인트와 시간 아까운 영화 뭐라고 할말이 없을정도로 OOO기 중의 쓰레기
6,이성경이 유해진 좋아하는 내용을 왜 넣었는지 1도 이해할수 없었음 보니까 큰 내용이 이성경이 유해진 좋아하는거 하고 아들의 레슬링하고 두개가 있는거 같은데 연관성도 하나도 없고 따로 놈 돈 주고 보지는 않고 따로 구...
8,가벼운 맘으로 본 영화인데 의외로 높은 완성도에 놀랐네요. 구멍없는 연기들도 좋습니다.
10,"난 재밌게 봤는데, 다들 연기도 잘하고, 물론 엄청난 영화까진 아니지만, 대작인척 졸작인 영화도 많던데 그런영화보단 훨씬 나은듯함. 7-8점정도 생각하지만 평점이 너무 낮아서 10점줌"
1,좋은 배우들 버리는 영화
5,레슬러를 가장한 환상 로맨스 킬링타임용으로 한참 부족한 한심한 영화
2,보지마세요 보지마세요  어쩔수없으면 보다가나오세요
2,도대체 뭘보여주고싶은 영화여? 배우들이 아깝다
1,보통이다  여러분 보지마세요
2,배우들이 아깝다.. 대체 왜...?!
7,그래도 주말에 시간때우면서 보기 괜찮은 영화임
3,아재 판타지 영화...나도 스무살은 아니라도 띠동갑 사귀고 싶다 ㅋ 살결 하얗고 청순한 애로 ㅋ 엎어치기 맨날 할수있는데 ㅎㅎ
6,여진구랑 김민재랑 넘나 헷갈리는 것. 목소리까지 비슷해 ㅠㅠ 여진구 나오네 하고 보다가 검색하고 김민재인 줄 알았음ㅋㅋㅋ
10,도대체 이 영화 평이 왜이러죠? 진짜 너무 하네영화 정말 재밌고 유쾌하고 감동적이게 잘 만들었고 부족한 면모가 없는데 ? 웬만해서 평 안쓰는데 너무 재밌게 봐서 평 쓰려고 들어왔더니 알바들이 개념없이 판을 쳤나영화 ...
10,설정이 비현실적이기 하지만 암튼 재밌고 보고나서 기분좋아지는 영화
10,젬있어요 꼭보세요 꿀잼
1,무엇을 얘기하고자하는지 알수가없네요 왜이런영화를 만들었을까요....
1,"진짜  전에 봤다가 정말 재미없어서 중간에 보다가 나왔는데 이제야 리뷰 적어보네요 내 돈 7000원 돌려내라 진짜 너무 아까운 돈입니다 팝콘,사이다 먹는 시간이 더 재밌었을 정도입니다. 진짜진짜 재미없었습니다..."
10,그냥 그냥 마동석으루위한 영화 그 이상도 이하도 아닌 느낌
1,동성애를 당시 여기며 애비를 업어치기 하는 모습이 자아 성장의 모습으로연 비취는 게... 참 잘 나간다...
1,"이게 영화가, 김대웅을 기억하라. 김대웅을 기억하라.."
4,"말하고 싶은 것을 알겠으나, 잘 풀어내지 못했다고 느껴집니다. 그래서 이성경님이 류혜진님을 좋아하게 된 이유를 쉽게 공감을 못하게됨"
10,아줌마에 연하남이면 심쿵사ㅇㅈㄹ하면서 성별바꼈다고 더럽다는 한국여자클라스오지네ㅡㅡ
1,이런영화도있다니.. 화가난다진짜ㅋㅋㅋㅋ
1,ㅠㅠ 안타까웟다리무슨내용이였는지 기억이 안난다리
1,최근에 본 영화중에 가장 허잡함
4,무슨 얘기를 하고 싶은건가...
4,생각보다 재미는있는데 후반가면 보기싫은장면이 나와서..그래서 하고싶은말이 내가 하고싶은걸해라 이걸말하고 싶은건가요?
3,보는 내내 짜증나네. 딱 3점짜리임.
10,"잼없다고하여 안볼려구요 프리미엄 월정액이지만 ..보면서 열불나고 기분나쁠거같아..댓글들 김사합니다.가디언오브갤럭시 1,,2,,보세요 진짜 잼있어요"
1,대단한 영화. 티비서 보여줘도 보지 마세요
3,어우야 혼란스럽다 유해진 뭐하노 이런거 찍거
1,아재판타지영화의 끝판왕. 유해진이고 이성경이고 무슨 생각으로 이 영화를 찍었는지 알 수가 없다..유해진은 진짜 믿고 보는 배우였는데 이렇게 뒷통수를 아릿하게 만드네..속이 울렁거려서 차마 끝까지 보지 못한 영화.
9,폭력성 잔인한영화보다 훨 좋아요
10,완전 재밌어요!! 잘 봤습니다~
1,소재가  충격적이다 전혀 공감도 안된다
8,영화 색감이 귀엽고 나름 볼만한 영화같구만 되게들 뭐라하네. 나는 재밌었다
6,"19살 여학생. 마흔 살의 남자. 그리고 마른 외형, 닮은 생김새."
1,삥뜯기? 제발 너네들은 다시는 영화 만들지 마라...
1,평점보고 볼껄....
10,이게 재미없다고?너무 재밌게 봤는데
10,40대라고 왜 사랑하지 못하게 하는가. 결혼했어야한다. 감독은 반성하라
1,"아 진짜 더럽다.. 친구아빠를 좋아하고, 덮치는 프레임을 씌우는곳에서 진짜 토할뻔했다. 그리고 선보러가고 난 후 여자는 뭐? 엉덩이 비치는 치마를 입어야한다고? 이런 여성비하적인 영화를 유해진이 찍다니. 유해진믿고 ..."
1,충격적입니다. 내용도 재미도 감동도 전부다
1,감독의 로망이 담긴 영화 딸뻘 여자애가 뭐가 아쉬워서 친구아빠를 좋아하나? 아빠가 정우성 원빈급이라도 힘들어.. 평범한 아저씨인데 대체 왜?이영화보고 친구딸보고 이상할 생각할 아재들 역겹다
1,감독아 양심껏좀 살자!! 주겨버릴까!!
4,이성경이 유해진 좋아하는 연기가 전혀 와닿지않네요
7,"볼만해. 재밌어. 유해진, 황우슬혜,"
10,괜찮은거 같은데..재밌네요
1,친구아빠...아빠친구...끔직한 영화구나...공포물보다 더공포다.
4,너무 억지스러운 부분이 없지않아있네요 ..
3,좋은 재료로 상한 비빔밥을 만든 사례
1,ㅋㅋ이게 지금 이 시대에 나올만한 영화라니 놀랍네ㅋㅋ 친구 아빠와 아들 여친ㅋㅋ 친구 딸과 아빠 친구ㅋㅋ 아빠 질투로 시작해서 갑자기 반항. 하기 싫다 아빠가 시킴. 아빠는 너 땜에 시킴. 치고 박고 싸우다 하하호호...
1,이걸 영화라고 만든게 역겹다 진짜
2,재미도없고감동도없고  불쾌하고 스토리도 이상하다 집에서 돈주고봐도 아깝다내4500 원 ...
1,진짜 이딴 영화 만들거면 영화감독 하지말아라. 재미 감동 하나도 없이 진짜 OOO기. 보고싶은사람 있으면 정말 비추..시간 버리지말고 차라리 운동해라
1,"배우는 배우고, 아닌건 아닌거다."
8,가족과 함께보기에 즐겁고 행복한시간 되었어요
10,꿀잼요 빨딱 섰습니다ㅎㅎ
1,제발 보지마세여 진짜 최악 스토리 최악유해진 보고 봣는데 실망...
6,기대 없이 볼때 유쾌한 영화. 평점을 지나치게 낮게 주는 불편러들의 마음을 사로잡지 못해 안타까운 영화.
1,"오랜만에 평점 드립니다. 5.2 도 후한거 같은데 평점이 너무 높네요. 감동스포츠영화도 아니고, 멜로도 아니고, 코미디도 아니고~정체가 먼가요?"
1,"이것도 영화라고, 참, 절라 잼 엄음다, 유씨 나오는영화  유씨 주연 영화 잼있는거 뭐 있을까요?"
1,에고...보는 동안 한숨이..출연진이 아깝네요.
1,처음으로 1점 남겼습니다... 유해진 님 좋아하지만 죄송합니다...
1,2프로 아니  20프로 뭐가 비엇어 그리고 재미 잇을것 같으면서 너무 재미 없고 지루해
10,걍 볼만 하던데...ㅋ
1,리얼 염력 레슬러..이번생은포기해야겠다ㅠㅠ
6,집에서 다운받아서 밥먹을때 심심치 않게 보기 좋은 영화..
8,쓰레기들 많네 내가 진리다 딱 7.0 정도 되는 영화다
10,기대없이 봤는데 유쾌하네요^^
10,그냥 볼만했는대 1점 넘 많아서 10점줌
1,정말 정말 정말로 재미없습니다. 제목이랑 별 연관도없습니다.
2,제일 재미없던 영화ㅜㅜ
10,음 20살이 40살을 좋아하다니딱 내 취향존좋
1,ㅈ진짜 돈주고 보면 안되는 영화
6,이성경 너무이쁜듯 ㅎㅎ 그럭저럭 이성경때문에 봣네요
6,70% 까지만 재밌음...
8,잔잔하면서 가족의 의미를  또한번 생각하게 하였음
8,별점 테러수준은 아님. 유쾌하게 볼만함.
10,"예상 과 너무 다르긴 했지만 상당히 많이 웃으면서 잘 봤습니다. 연기들도 다 좋고, 특히 황우슬혜씨 똘끼 연기 진짜 배꼽 빠졌어요."
7,실망스런 부분도 있긴 하지만 별점테러에 심한 독설을 들을 정도는 아닌 것 같은데 댓글보니 특정 여자들의 집단적 광기가 정말 더럽네. 머 눈에는 머만 보인다더니
1,레슬러라는 소재란 영화가 소재밖으로 나가버리고 의미도 없고 재미도없고 멋진배우들 대리고 너무 했다.
1,그나마 황우슬혜 덕에 1점 준다.
1,돈 존나 나가는 영화^^
1,마블이 왜 영화를 잘만들었는지 말해주는영화
2,유해진에 대한 의리로 2점이다!  아 진짜 드라마 1편보는거 보다 재미없으면 어떻하란 말인가! 간만에 보는 졸작이다!
10,그냥 볼만하죠 뭐 ㅋㅋㅋ
10,재밌었음ㅋ내용이 신선했음 근데 제목이 레슬러..는 아닌듯? 그리고 뷔페미년들 시선강간이니 뭐니 이딴말 씨부리면서 좌표찍고 왔나본데.. 적어도 6점짜리는 아님. 7~8점짜리
1,이런 영화는 도대체 왜 만드는 걸까?
6,생각치 못한 설정은 재미 있었는데 풀어나가는 방식이 시시했음.
2,반칙왕이 더 재밋지않냐
10,챔피언보다는 훨씬 낫다 사실 7점에서 8점짜리 영화지만 평이 너무 낮아 높게준다
1,유해진이라서 본건데 1점도 아까운영화내가 왜 이걸 끝까지 봤나 후회될정도
8,감동이 오다 마는 영화 그래도 볼만함
8,유해진 믿고봤는데 중간에 루즈한부분도있었어요
1,이성경때문에보기가더싫은영화 보다껏음
10,민재랑 성경이가 좋다 ㅋㅋㅋ배우가좋음힘내라 배우들
10,말도 안되는 시나리오도 많다~ 물론 레슬링에 촛점을 맞추면 실망스러울수도..그래도 잘봤다 아마...4-50대 남자들은 잼났을듯~~???
8,나는 나름 짜임새 좋고 재밌었다고 생각한다..유해진 성동일 배우 연기는 언제나 웃기다
1,재미도 없고 내용도 이상..
1,최악이란 말도 아까운 영화
8,평점 왜 이러지  블록버스터를 바라는것도 아니고 그냥 편하게 웃으면서 볼만한 영환데? 난 재밌게 잘 봤다
2,캐릭터들 개성들이 정말 특이하네요
1,내돈주고 본게 아닌데도 시간이 아까워 죽겠다
1,이것을 보여준 친구가 나에게 사과를 했다.
6,말도 안되는 영화지만~ 그냥 그럼~ㅎㅎ
10,소소하게잼있어요~~
1,앞에는 괜찮았는데 갑자기 아줌마 좋아해요? 그리고 아빠랑 싸워? 막장임
9,나름 괜찮았던 좋습니다
6,시간가는지 모르게 정말 재밋게봤네요
7,잘나가다가 막판에 똥 되버리네 갑자기 아빠랑 레슬링을 거기서... ?
10,전 정말 재밌게봤습니다
1,이런데 평점 첨올리내요 정말 이게뭔지 하~~내시간
8,왤케 테러당하는거지 난 소소하게 잘봤는데
1,개노잼 보지마세여ㅜㅜ
6,이성경이 이쁘게나오는.. 아들여친과의 판타지물?..
8,"적당히 흥미롭지만, 판타지스럽다."
6,그닥 뭐 재미가jQuery224049371103616236567_1528885336843??
1,타이틀과 다른 갈길 잃은 막장 드라마임 ..소재좀 정상적인걸로 선택하시길..
4,가족영화치고는 너무 막장이다...
1,와 진짜 1점도 아깝습니다.
8,나쁘지않네요..버닝보다 훨씬 재밌구만.. 중간중간 깨알재미가 솔솔.. 김민재가 꼴보기 싫어서 그렇지 괜찮음
2,그냥 그렇게  봤네요 ㅎㅎ
10,웃으며 봤어요 ~^^ 나름 괜찮아요
8,나름 재밌었어요 친구딸이 좋아한다니 ㅎ ㅎ ㅎ
6,그래도 훈훈하게 재밌게 봣는데 ㅎㅎ
5,왜 한국 제목이 레슬러인지 1도 이해 불가.. 레슬러의 삶을 제대로 표 한것도 아니고 만약 내가 레슬링하는 사람이라면 저어어엉말 불편한 제목 글고 내용 정말 불편하다 심각허게
1,"왜 봤지?,,,,ㅡㅡ"
10,괜찮음. 유치한 국뽕 영화인줄 알았다가 러브라인에 이성경의 매력하며 유해진 연기죽이고 키즈 리턴   내여귀 같은 드문 조합임. 재미짐.
4,돈아까웠어요.. 재미도 없고 감동도 없고레슬링 내용 까워 맞춘느낌
10,"오랜만에 휴먼코미디, 감동이었다.가족애가 물씬 풍기는 영화다.배우 유해진을 위한 영화."
10,재미와 감동이 있었어요~^^
6,한국판 당갈이다 이거볼빠에 당갈봐라
1,진짜 OO 같은 영화. 이 영화를 고른 유해진의 안목에 실망했다. 아들새끼 발암. 아무리 철이 없기로서니..진짜 개 발암.
1,챔피언은 피했는데 이 영화는 못 피했네
1,"레슬링 내용보단 '친구아빠가 좋아요'라는 제목이 더 어울릴듯. 여주는 강제유학보내지고, 아들은 파파보이인지,  억지감동주려해서 보는내내 불편함. 배우들이 아까움. 제발 한국영화 막 만들지 마라."
1,유해진씨 왜그러셨어요..ㅠ  영화 하루이틀 하시나.. 이런 시나리오를 고르시다니..누가봐도 노잼인 영화..
2,"아버지와 아들 부자간의 이야기, 자식과 부모간의 이야기, 철없는 20살의 아저씨를 사랑한 이야기 등등 여러요소를 담고싶어했지만 이를 끌어내는 방식이 너무 부자연스럽거나 연계성이 떨어졌다. 몇개의 연출은 왜 저런 방식..."
1,장난치냐 진짜 무슨 좀 아 기분더럽네
3,돈 주고 안봐서 다행인듯하다....20대 아가씨가 50대 아저씨를 사랑한다는 내용 좀 이헤 불가..
10,이성경은 이쁘더라구요..거기까지 ㅎ
1,황우슬혜만 좋았다영화는 진짜 별루
2,시부모님 끊어드렸는데...ㅠㅠ 완죤 죄송했음
1,도대체 감독 사상이 뭐야? 저급하고 레슬링하는건10분도 안나오느낌 실화?
3,황우슬혜는 코믹연기 잘해서 3점드림. 이런저런  재료들로 비빔밥 만드려는데 고추장은 빼고 만든 그런 영화
6,김민재의 재발견 연기 참 좋았고 모처럼 따뜻한 가족영화네요
1,휴 . . . 휴 . .  휴 . . .
10,관객들 너무 진지하게 본다 우리엄마는 보는 내내 깔깔깔 웃더만  애당초 말도 안되는 시나리오 아닌가? 뻔히 관객들 웃으라고 만든영화에 진지빠는 애들 뭐지 평점 1점은 솔까 아니고 9점정도는 아니지만 가족끼리 바람쇠러...
1,이런 영화가 시나리오가 통과되고 투자를 결정하고 수많은 사람들의 ok를 받고 만들어졌다는것에 경의를 표한다. 되도 않는 러브 라인에 엉성한 나는 레슬링이 싫어요 신파.... 하.... 반칙왕을 한번 더 보겠다.
2,그저웃는다 이런걸만드는이유가머냐
1,평점을 보고 봤는데도 정말 이정도 일줄은 몰랐다. 세상에 이렇게 보기 불편한 영화가 있을까? 아빠한테 바락바락대드는 아들과 친구의 아빠를 사랑하는 러브스토리. 어설프게 신파극으로 몸도 안좋은 아빠. 진짜 최악의 조합...
1,배우 섭외 어떻게 한거지..
1,이걸 영화라고 만든거죠?
1,"최근 10년본 영화중 가장 최악이다. 나문희, 성동일, 유해진...데리고 이런 역대급 쓰레기를..."
10,너무 재밋다해~헤헿헤헿
1,무슨 이딴게 영화라고 상영되는거지 도대체 그냥 비디오로나 만들지
1,감독님. 앞으로 영화쪽 일 안하셨으면 합니다.부탁드립니다
1,쓰레기 영화.. 배우들이 아깝다..
1,레슬러라는 제목에 맞는 스토리였으면 더 재밌게 봤을 것 같다. 스승의 날에 교수님과 함께봐서 더욱 뜻깊은 영화였다. 영화를 보다가 점점 이상하게 흘러가는 내용 때문에 나오고 싶었다. 혼자 봤다면 도중에 보다말고 나올...
8,그렇게 재미없진 않다.
2,쓰레기 영화. 유해진씨 정신 차리시길...영화보고 토나오는건 처음일세.별 하나도 아까운데 댓글 쓰려니 어쩔수 없이 하나 준다 옛다 먹어라 별하나
1,성동일은 클X우드를 좋아한다는걸 알게되는 영화
1,ㄹ1랲ㄷ맟ㅇ잧ㅈ마ㅣㄴㅊ대
1,진짜 내인생 최대 쓰레기 영화
8,영화로 보기엔 아쉽고 이성경 좋아하시는 분들은 이성경 이쁜모습 보실수있을듯...
4,돈이 아깝다 제발 이런건 만들지도 말어라
1,뭔 당최 말이 되야 이해를 하고 보지.. 뭔 친구 아빠를 조아햌ㅋㅋ그정도 파격적인 내용이면 서사가 그 앞에 마니 깔려야된다 진심 이거 감독 각본 쓴 사람들 다 노이해ㅋ 요즘 관객수준이 얼마나 높아졌는데 이런 영화를....
10,나름 재미있는데 평점 ㄷㄷ
3,그냥 재밌게 볼수있는영화
1,이딴 영화는 도대체 왜 만드는거냐 돈이 쓸데가 없으면 불쌍한 사람들이나 도와라.
5,논스톱으로 보기 힘든 영화..잠과 싸우며 세 번째만에 겨우 성공.부자와 미소녀와의 삼각관계.왠지 스토리라인이 불편하다.한 가지 위로는 유해진 페이스에 이렇게 괜찮은 미녀 둘이 목매는 게 실화이길..희망고문이 생긴게 ...
1,평점을 보고 보러갔어야 했는데... 류해진만 보고갔다가 당했네
10,믿고보는 유해진   잔잔한 감동
10,평점 안좋길래 기대 안하고 봤는데 스토리 참신하고 웃기고 배우들 연기도 잘하고 엄청재밌는데 다들 영화 평론가들이신가 ㅋㅋㅋ휴머니즘도 녹아있고 부자지간 갈등도 되게 빠져들면서 중간중간 너무 웃긴상황도 많아서 재밌게 봤...
7,가끔씩 나오는 BGM들이 좋더라
1,설정 자체가 너무 역겹다
1,좋은 배우들이 고생 많았네요. ㅡㅡ”
8,늘 불편한 쿵쾅이들 때문에 8점.
8,나름 볼만했어요. 재미와 약간의 감동 괜찮았어요.
10,잼있는데? 유쾌한 영화
4,결말이 일본정서네.. 스토리도 뭐 그냥무난하고.. 재미없는것고 아니고 재밌는것도 아니고.. 이런 영화 나오면 한국에서 흥행못하지.. 근데 왜 제목이 레슬러인지 한걸 결말에서 억지로 보여주려고 만든영화같음. 그 조연들...
6,제목을 잘 못지은듯 레슬링 비중이 너무 없음 돌아이 연기가 재밌었음
8,황우슬혜 때문에 재미있게 봤다. ㅋㅋ 너무 귀여워. 발음이 좀 뭉개지는거는 개선 하면 좋겠다.
2,나 영화평점 박하게 주는 사람 아니다. 여태까지  내가 평점 준 거 확인해보길. 도대체 이 영화가 말하고자 하는 게 뭐냐. 레슬링 영화도 아니고 멜로? 코메디? 끝날 때까지 횡설수설이네. 진짜 노잼에 쓴웃음을 짓게 ...
6,그냥 킬링타임으로는 괜찮았는데;; 설정이 이상하긴 했지만
1,억지 감동 모순 스토리 개똥쓰레기 전개 전형적인 한국영화 이거 볼빠엔 원피스 극장판 보세요
2,"제목이 운동계열이라 열정적이고 치열한 장르인줄 착각으로 본 영화. 장르, 내용, 모두 불명확하고 후반까지 떡밥만 뿌리다가 '시간없다 그냥 접자'하는 느낌으로 마무리. 문제에 대한 태도는 상식선에서 생..."
1,진심 앞으로 유해진수준이 떨어질꺼같아
7,평소에 별관심없었는데  여기서 이성경 진짜  이쁘게나오네..    내용은 뭔가핵심은없지만.. 나쁘지않았음.
7,"무료로 봐서 그런가 그렇게 최악의 작품은 안닌데요. 부모로써 자식과 소통되지 않아 겪는 고충 잘 표현해 주었습니다. 그 예가 너무 극단적인 감이 없지 않아 있지만, 참 바다씨 결혼도 않아고 갑갑한 부모역활 잘 소화 ..."
1,유해진씨 실망. 럭키로 대박치고 후속작이 이딴거라니;;ㅜ
8,김민재가 다 한 영화ㅋㅋㅋㅋ
4,이 영화에서 젤 이해가 안되는 부분은 이성경이 아저씨를 좀 좋아했다고해서 그걸 철없는 행동으로 규정하고 결국 마무리에서는 이성경은 도피유학을 가게되고 엔딩까지 안나온다는거... 이게 도대체 무슨 마무리지.. 흔치 않...
1,유해진이라는 그릇을 담긴  감독의 역량이 너무나 부족하다!럭키  공조   택시운전사   1987  그리고 ... 하지만 이따구 영화.이번만 감독 잘못 만나 돌뿌리 걸려 한번 넘어졌다치자...아직도  당신 영화면 믿고...
6,그냥뭐.. 그럭저럭 웃으면서 잼께 봤는데 평들이 너무 안좋네; 하긴 레슬링 영화도 아니고 삼각로맨스도  아니고 급 아버지와 아들이 화해? 좀 그렇긴해 별 내용도 없고.. 챔피언도 그랬지만.. 그래도 뭐 웃으면서 봤으...
6,B급 코메디영화인데 그것에도 약간 못 미치는 C급 영화쯤.. 제목은 왜 레슬러인가? 차라리 '옆집 아저씨' 이런 제목이면 이해라도 갔을듯.. 그런걸 떠나서 소재가 너무 황당스럽고 또 20대의 사랑을 철...
2,요즘은 어른이 없네요 어리다 미성년이라는 이유로 싸우고 술먹고 그래도 이해가  되는 이런 그지같은세상...
10,난 엄청 재미있었어요 진짜 영상미 좋아
1,보다가 빡쳐서 잠도 안옴
2,중반까진 괜찮았는데 후반부터 뭔 막되먹은 스토린지... 배우는 배우대로 연기하느라 고생했는데 이걸 스토리가 말아먹는건 참... 네이버 평점 잘 안믿는데 이건 정말 믿고 걸러야 한다.
6,그냥저냥 평범한 한국 영화. 다만 황우슬혜가 매력이 터진다.
1,아 이건 예고편 보고 난 안봐야지함아니 이성경 누님을 가지고 뭔 이상한캐릭터를 만들어 장난하나 이건 딱. . 예고편 보고 이건 매우 불쾌했음이성경 팬으로써
10,재미있게 봤습니다. 유해진씨 요즘 작품 다 좋네요
10,와나는 너무재밌게 봤는데 평점이 완전..ㅜㅜ웃음포인트가 나랑만 너무 잘맞나
10,킬링 영화로 보기에 좋습니다
8,유해진씨는 늘 실망시키지않네요영화 잘봤습니다^^
1,유해진에게 낚였다. 내가 영화찍어도 이것보다 잘찍겠다.
1,OOO기 영화 이런걸 왜 만드냐
1,아니 대표 주제가 레슬링에 대한 스포츠영화인지 알았더니... 영화의 반이상이  20살 차이나는 여자얘가 아빠 좋아해서 빡친 아들이 경기중에 아빠 집어던지는 영화ㅡㅡ... 내용 진짜 어처구니가 없다ㅋㅋㅋ
8,이야... 평점 조작 멋지다~!!! 평점 조작하는 애들 아이디 클릭해보면 1점 아니면 10점임 ㅋㅋㅋ 간만에 잼있게 본 영화 이렇게 묻혀버리네~!? 뭐... 난 니들 조작질에 안넘어가고 봤으니까 승리자 ㅋㅋㅋ 열심히...
1,이건 정말 아니잖아....
1,애인있는 여자에게 고백하려 선발전 도중 뛰쳐나가서 일반인에게 맞는 국대급레슬러아빠. 애인버리고 10살어린남자랑 결혼한 엄마 .친구아빠를 좋아하는 아들여사친. 아빠랑 삼각관계에 빠져 서로 치고박고 레슬링한판하는 아들....
5,딸 되는 여자와 어긋난 사랑은 그렇다쳐도 게이 친구에 아버지 패대기 하는 아들까지. 막장 스토리 영화. 짧지만 황우슬혜의 미친 존재감이 빛났다.
10,"저는 넘 재밌게 담백하게 봤어요, 따로 노는거 같지만 같이 어우러지는 뭔가가 있어요~"
2,해진님 제발 조연만해주세요.영화 초이스 선택을잘하던가.돈주고는 어벤져스만 보고싶잖아요 제발ㅠㅠ
5,"이성경이 유해진 좋아하는 거에 가슴 떨렸던거, 은근이 이성경 매력있다는거(전에는 마스크도 싫고 그냥 싫었는데... 너무 매력있음) 말고는 아무것도 없음. 전혀 없음... 이성경 때문에 5점... 해진 형님.. 이런 ..."
10,도나씨~~~~너무좋아요~~ㅋㅋㅋㅋ
3,저 포스터보단 좋은 영화인데 여기저기 찔러만 보는선에서 끝나는게 아쉽네~
1,대한민국 영화계가 여성을 대하는 태도  잘 봤습니다~
1,어디 OO같은 스토리를.. 초등학생 일기가 더 재밋것다 계속 욕하면서 봄 스토리 모야 진짜
1,돈 물어져..욕나온다..감독은 배우들한테 죄책감가져야 한다..
1,그냥 대사 왜우고  영혼없이 찍은 영화 유해진도 다됐네 ㅠㅠ
7,그냥저냥 볼만합니다ㅎ
1,내가 만들어도 이것보다 재밌게 만들듯...
1,"신선한 소재인데 비해 억지 감동 짜아내기, 뻔한 전개 등등 좋은 배우 쓰고 이렇게 코믹하지 않게 만들기 힘들었을텐데 이렇게 낮은 평점 드려 죄송하지만 저의 시간이 이렇게 소비 된거는 어떻게 보상 받습니꽈 ~~~"
