score,review
2,안타갑네.. 별로네.. 스토리별로 구성별로 킬링타임용도 별로 그냥 별로
2,오 지져스... 대체 내가 뭘 본거지??기억에서 삭제 하겠습니다. 매트릭스는 레볼루션까지 있던걸로.... 잘가요 키아누...ㅠㅠ
2,나오지 말지.... 전 작을 다 망가트리는 후속작이다....실망이다 위쇼스키...
8,중간에 살짝 루즈하긴 하지만...전편에 대한 예우와 시리즈의 새로운 완성이 담긴 좋은 후속작
4,세월을 극복하지 못한 부활. 라떼가 되버린 전설. 범작이 되어버린 명작.
1,사창가에서 다시만난 첫사랑 누나를 보는 느낌
5,"스토리, 개연성, 액션, 배우, CG, OST 모든게 아쉽다. 원작을 망친 리부트~3부작 팬이라면 더 피해야 할 4편"
5,새로운시도를해야할텐데 옛거를
4,아... 매트릭스 이번편 ....아....보다가.... 아.... 보다가.... 아....감탄사가 아닌 탄식만 남는....아...트리니티와 네오 때문에 의리로 별한개씩 해서 두...개...아..감상포인트도 할거 없었...
10,"전혀 처음부터 끝까지 한순간도 질리지 않았고 하나하나 중요한 장면들이었으머 대사 한마디 한마디가 와닿았다 모피어스와 스미스의 캐스팅이 아쉽지만 매트릭스 팬으로서 전혀 실망스럽지 않은 스토리였다 1,2,3을 깨우친 상..."
10,고맙단 인사(리뷰)를 하러 왔어. 잘 가라 매트릭스.
7,
2,"졸면서 보느라 꿈인지 생신지, 진정 내가 매트릭스속에 있는기분"
8,너무 너무 반갑다... 3편 이후의 뒷이야기도 나름은... 하지만 기대를 많이 한 탓일까??? 그냥 부록 같은 느낌은 지울 수가 없다. 매트릭스 팬으로써는 좋으나 전작에 비해 영화적 요소는 아쉬움이 많이 남는다......
4,원작자가 만든 자기파괴적인 후속편. 앞 영화를 보지 않았다면 제대로 이해하기도 어렵다.
7,
2,더이상 새로울 것도 없는 추억 풀을 뜯어먹고 사는 불쌍한 염소. 그 이름은 라나 워쇼스키
5,무엇을 위한 리저렉션이었는지 잘 모르겠다.
10,"""지루하다""ㅡ전작은 철학같은 깊은주제를 갖고있지만 오락적요소가 높고 액션도 매우많아 흥미진진하다. 전작들에비해 리저렉션은 지루해 보일수밖에 없다. 액션씬이 꽤나오지만 앞편보단 전투씬이 적고, 대화씬이 ..."
3,진짜 뭔소린지 하나도 모르겠다...
10,무겁고 철학적인 전작과는 다르게 분위기가 너무 가벼움. 배우들 연기 자체도 가벼운 액션 코미디용 연기임. 연기를 못한다는 게 아니라.. 그런 가벼운 분위기로 이끌어감. 그 관점에서 특히 닐 패트릭 해리스는 내가 진짜...
4,후... 아쉽다.. 상상력의 끝은 있구나..어쨌거나 당분간은 잠재울 수 있겠어. 이것이 인류에 도움이 된다면 응원하겠다
6,음... 그냥 그렇다...
4,굳이 만든 이유를 모르겠다.
7,
10,진심 재미있었다 난 매트릭스5 기대한다 제발  다음 씨리즈 또 나오길바랍니다김사합니다 위쇼스키 자매님들 맞나? 암튼 자매님들 감사합니다~! 여운 장난아님
6,지루한부분도 있지만 그럭저럭 볼만함~
4,보다보니 영화에대한 집중도나 기대감보다도 매트릭스1이 그리워지는영화ㅋㅋ매트릭스시리즈 다소장하고있는데 1이너무보고싶어서 다시보려하는중 그렇게만드는영화ㅋㅋ
4,매트릭스 1의 아성을 넘지 못하는 크나 큰 아쉬움
6,존윅이 정신차리기 전까지는 재밌게 봤다. 그 뒤로는..음...
1,이따구로 할거면 집어쳐
2,드럽게 재미없네 10자도 아깝다
2,강추 진짜강추수면제
7,move on 보다는 추억과 회상~
8,"이전 시리즈의 철학적인 메시지와 깨달음은 없고 간단한 영화지만 추억팔이와 시리즈에 대한 자학개그, 돌아온 캐릭터들이 좋았다.이후 시리즈에서 발전할 가능성이 보인다."
1,이만하면 자신의 영화를 희생해서 현재나오는 히어로물을 까려는 시도로도 보여진다.최악 그자체다.
4,존윅과 매트릭스의 끔찍한 혼종
1,최악 절대로 다시는 태어나지 말았어야 함
3,명작 트릴로지에 먹칠을 해버리네.
6,그냥 리부트로 내놓던가 시퀄로 내놓던가 했어야지ㅡㅡ네오랑 트리니티가 왜 기억을 잃고 매트릭스에 갇혔는지 어떤설명도 없고..이영화를 첨보는 관객까지 이해시키려고 전작들 스토리까지 어거지로 욱여넣어서 개난잡하고 스토리가...
3,이미 끝난 이야기에 속편을 만들려고 어거지로 이야기를 이끌어 가는 기분...모피어스와 특히 스미스를 다른 배우로 대처한 부분은 몰입을 상당히 떨어뜨리고 뜬금없는 연출이 속속 나올 때마다 워쇼스키 감독은 이제 퇴물이 ...
6,"네오,트리니티는 반가웠지만 그 외에는 딱히 좋은 점이 없는 영화 액션,스토리 모두 실망스럽다 부활하지 말았어야 하는 영화"
6,이건 현실이 아닌 매트릭스다. 매트릭스가 이런 영화로 돌아올 리가 없다
10,5편을 기대하며 일단 봄 ㅋㅋㅋㅋ
9,"평이너무 안좋아서 볼까말까 엄청고민하다 똥인줄 알고 먹는기분으로 봤는데 매트릭스1,2,3 재밌게 본 사람으로써 전 만족했습니다다만 액션이 너무 전작에 비해 별로 하…"
1,"하 보지마라 앵간하믄, 예고편 부터 불안불안해따"
10,"개인적으로 저는 너무 재밌고 마지막엔 감동이였어요, 옛날처럼 무거운 액션영화라기 보단 중간중간 유머러스한 부분 너무 무겁지않게 너무 재밌게 봤습니다.매트릭스 짝짝짝"
2,이전 매트릭스 생각하면서 봤다가 2시간27분 동안 목이 꺾일 정도로 꿀잠잤습니다.감독님이 영화보따리 떼어내더니 감을 좀 많이 잃으신듯
8,매트릭스 찐팬인데 시리즈만의 액션의 ‘멋’이 없음. 뭐랄까 어릴때 정말 좋아했던 라면을 드디어 다시 먹게 되서 반가운데 MSG가 빠진 맛이랄까.
1,올해 본 영화 중에 제일 볼품없었던 영화. 개연성도 없고 씬마다 혼란만 주는 영화. 전편들을 자꾸 카피캣해서 보여주는데 그만큼 감독의 상상력이 더 이상 발휘안된다는것을 심오하게 보여줘서 안타깝다. 연말에 매트릭스말고...
1,내가 알던 매트릭스는 없다. pc와 납득안되는 오마주와 이상한 클리셰가 합쳐져 단순 로맨스물이 되었다. b급 개그를 치며 감동을 해치는건 별도.
10,"20여년 전 매트릭스 1을 봤을 때의 전율과 짜릿함은 없지만, 쌓인 시간이 주는 질감이 있다. 네오와 트리니티, 워쇼스키 감독과 함께 나이들어가고 그 세월을 같이 했다는 것이 나쁘지 않다. 보다가 울컥하는 장면들이 ..."
4,"삼류 배우들 연기연습, 액션연습하는거 돈내고 보고 싶으면 보세요."
8,솔직히 세월이 많이 흘러 내용이 가물가물해 재미가 없다고 느껴지지만 네오와 트리니티가 중년이되서 만나는 부분도 감동적이고 스토리연출뭐하나빠지는게 없는 완성도 높은 작품이다 모피어스가 함께하지못한부분은 아쉬웠지만 다만...
1,내가 제목을 정해주마.... < 매트릭스 死 >
2,아니야 팬들이 원했던 건 이게 아니야.... 다 그렇다치고 액션은 왜 더 퇴보한거야...
5,존윅 4 언제 나오더라.. 같은 생각만 계속 들었다
6,호부견자. 개연성이 부족한 힌두이즘 혹은 화려한 가식.미안하다. 그만 알아보자...
1,개연성도 없고 스토리는 뻔하고 새로운 캐릭터들은 설득력도 없도 공감도 안되고 예전 캐릭터들은 그들만의 개성도 떨어지네요. 전작의 기대를 내려 놓고 그냥 영화 그 자체만으로 본다 쳐도 기본적으로 영화의 자질조차 부족한...
5,"감독이 겪었을 속편에 대한 고민이 매트릭스 2,3편에 비해 훨씬 난이도가 높았을 듯. 간신히 이야기가 말이 되게는 만들었는데 정말 만드는게 고역이었듯한 티가 팍팍 날 정도로 영화가 이상했음."
1,나오지 말았어야 할 영화
2,... 캣트릭스 ^^ 최고지.. 엔딩크래딧나올떄까지 기다린 내가 바보
7,이쯤되면 워너는 반성의 시간을 가져야...
1,휴고위빙 안나온게 최악의 한수가됬네
4,반쪽짜리 매트릭스..시리즈중 최악..지금까지 쌓아올린 모든게 이 한편으로 다 무너졌다....
10,생각보다 재미있네요 잘밨습니다
3,평점 9점을 준 평론가도 있네 ㅋ 왜지? 진짜 개졸작 이던데
6,매트릭스도 이제 추억이 되었네요
7,정녕 이전의 영광을 되찾기는 어려운 것인가
6,우리는 더 많은 올드함과 더 많은 새로움을 느끼며 살고 있습니다.그래서 그 선글라스가 낡아보였습니다..
6,...3편으로 마무리 했어도 괜찮을 것 같은데..
1,3편에서 끝내지 그랬냐...
6,"CG도 옛날만 못한 것 같고, 긴장감이나 연출도 예전만 못한 것 같고...   흘러간 배우들의 추억소환 정도였습니다."
6,"자가복제와 자아성찰, 자아도취와 자학의 그 어디쯤"
6,"감독이 여자가 되더니 트리니티를 개 떡상 시켜놨네, 트리니티가 각성하는데 좀 더 개연성있게 풀어 냈다면 어땠을까 싶음. 매트릭스 1과 비교하면 트릴로지 이후 시작점인데 너무 스토리 개연성도 부족했고 좀 어수선했다고 ..."
5,세월은 어느 장사도 이길수 없구나....
4,추억은 추억으로 .... 등따셔서 푹자고 나왓다
4,어거지로 늘린 스토리는 그렇다치고 액션이 근 20년된 영화보다 오히려 더 후퇴했음 이전작품 오마주 수준을 넘어서서 옛날 영상 떡칠이나 하고... 암만 키아누형이라도 나이는 못속이지
9,좀 먼가 옛날의 명작 느낌은 아니고 재미는 있었슴. 워쇼스키 여자로 됐다고 주인공을 여자로 바꿨냐? ㅋㅋ
6,팬이라면 그래도 재밌게 볼 수 있겠지만 입문자에게는 난해하고 복잡한 영화일 듯.
5,시작이 있으면 끝이 있어야 하는 이유를 알았습니다
5,의리로 보는거다 10자 압박
2,올해 본 영상 중에 최악이었습니다.부활이 아니라 다시는 돌아오지 못할 강을 건넌 느낌
4,좋은게 없다.. 부활이 아니라.. 부관참시 수준.. 매트릭스가 무슨 죄를 지었는가..
1,댓글 잘 안남기는데 이건 아니지 않냐 진짜
1,세계관을 늘어뜨리는데 중점을 둔 영화.매트릭스 프렌차이즈로 수익이 필요했던 건지뭔지 애매한 영화였다.액션은 구닥다리에 촬영기법도 기존 매트릭스 틀에서 벗어나지 못함찬란했던 구시대의 유물을 다시 열어보는 느낌처럼 매트...
2,매트릭스와 터미네이터는 딱 2편까지가 적당했다...
8,이전 시리즈들이 강렬했기 때문에 이를 생각하고 보면 실망이 클 수 있음. 영상미나 스토리 등 전반적으로 이전 시리즈들보다 후퇴한 느낌이지만 볼 만은 함. 쿠키 영상은 보면 욕나오니 패스하는 것이 좋음.
5,이럴거면 왜 돌아왔니~!
8,복습하고 봐서 꽤 괜찮았는데 평점이 왜캐 낮은거죠..?
9,반가운 네오와 트리니티의 복귀.
2,연출연기너무맘에안들어요 스키자매감독님영화퀼리티가 어떻게후진할수있죠
7,매트릭스 트릴로지를 섭렵한 아재들을 위한 뉴트로 영화
1,존윅이 저예산 b급 짭 매트릭스에 나온느낌
6,감회가 새롭네요
10,짠~ 합띠다.. 세월이란게..
2,뭔 영화에서 4광고를 오지게하는지 손발이 오그라들어서 혼났네
9,어깨 힘빼고 만든 영화. 워쇼스키는 어떻게 만들었어도 팬들 기대 충족 못했을거다. 액션신은 진부했을거다. 철학적인거 해봤자 뇌절이였을거다. 오히려 시온 그 이후와 네오 트리니티에 집중하고 미래로 나아간 부분이 너무 ...
7,"항상 내 인생 3대 영화라고 이야기해왔는데, 이제는 위태위태하다. 정말 마지막으로 한 번만 더 믿어볼게. 다음 시리즈는 신선하게 돌아올 거지?"
8,이전 매트릭스의 명성에는 미치지 못하는거 같네요.
7,"1,2,3편 복습은 필수고 4편은 좀 아쉽네요..."
2,그러니까 만들지 말랬잖아 ....
4,매트릭스는 딱 3편까지만 보는걸로
5,오랜 시간이 흘렀음에도 불구하고 시대에 맞는 방식이 아닌 진부한 촬영 방식과 연출적인 부분에서 지루함을 느꼈다 신세대의 새로운 배우들을 주연으로 세워서 진보된 매트리스 세계관을 풀어나가는 방식으로 보여줄 수 있었음에...
10,"전작을 미스터 앤더슨이 만든 '게임' 으로 만들어버리고, 새로운 매트릭스 시작ㅋ"
1,"1점도 아까운 영화 이영화의 문제점 (개인의견) 1) 대사가 너무 많음, 2) 그 멋있던 네오의 액션이 단발 휘날리며 양팔을 어렵게 뻗는 액션으로 탈바뀌어 멋이 1도 없음, 3) 네오만큼 매력적인 스미스캐릭터성이 1..."
2,1~3편까지 보고 느끼고 즐겼던 모든 감동이 ...OO 매트릭스4로 인하여 소중한 추억이 지워졌다.보지마세요. 빨간약= 매트릭스4. 그리고 여기도 빌어먹을 페미니즘 뭍혀있더라
1,재미는 없네요. 왜 만들었나요 ㅠㅠ
5,1~3편을 복습안하니 이해가 안됨
10,"평점보고 기대안하고 봤는데, 정말 최고였음,스파이더맨이 진짜 유치하고, 매트릭스는 스토리, 액션, CG, 철학적인 부분까지, 이런게 영화지,왜 스파이더맨이 평점이 높은지 이해가 안감"
4,감독들이 불알을 떼더니 급이 떨어져 버렸네
2,뭐지? 보다가 당황에서 깜짝 놀랐음. 느낌이 그냥 2000년대 미드... 공동연출에서 이번엔 동생이 빠져서 그런가....
10,저는 팬이라 그런지 여러번 다시 보고 싶을 정도로 좋았어요 후속편이 나왔다는 거에 의미를 두고
5,영상만 뿌린 느낌... 영상이 나쁜건 아니지만 영상만 뿌린 느낌이 그래서 그게 다이라 기대치 대비 감소...
2,최악... b급 애들 영화가 되어버림.. 포인트를 하나도 못잡음... 하아... 기술이 얼마나 발달했는데 1보다 못하지???
7,매트릭스 리저렉션
5,
5,
1,"위쇼스키dog년들 이야기 주머니 떼더니 그 뒤로 만드는거 전부 개차반되어버림.진짜 너무너무 화가 많이 나는데, 대충 여기까지만 하겠음."
3,이제 그만 놔주세요…..
5,상상력이...넘 아쉽다..그냥 매트리스안에서 다 박살내고(모든소스를 아니 초능력자잔아)현실에서도 그 능력이 빌휘되서 기계군단 다 박살내게 하지..또 시리즈 만들려고 다 나두는거냐?
1,시간이 겁나 안감. 꿀잠자고나왔습니다. 하....
10,오랜만에 본 매트릭스는 반갑고 좋았습니다
8,매트릭스는 여전히 스타일리쉬하다
6,액션에 불을 땡길것으로 예상했으나 대한민국 대선판같이 아무런 감흥도 없어서 아쉬움
7,첨에 윽... 이게뭐야..  했는데 괴랄한 초반부만 없애면  중반부부터 볼만할듯
1,중년액션영화. 개핵핵핵 노잼. 그리고 PC 까지 묻었어. 개핵노잼. 인생핵노잼 영화
7,"매트릭스와 비교하면 실망하겠지만, 독립적인 작품으로 본다면 괜찮은 영화"
6,워쇼스키 감독은 매트릭스 그만 좀 놔줘요;;;
2,도대체 뭔 영화인줄 모르겠다. 명작은 명작으로 남길것이지 쓸데없이 이름이랑 배우 팔아서 돈 벌려고하는 심보가 떡하니 보이는 영화. 명작시리즈를 가지고 이딴 쓰레기같은 영화를 만든 감독은 대체 무슨 생각으로 만든건지 ...
10,평점 낮아서 안볼라다가 그래도 안볼순 없지 하믄서봤는데 이거왠걸 추억돋음쩔고 예전배경그대로 가따써도 전혀 촌시럽지않다. 매트릭스 2021버전으로 업데이트찰떡임. 중간에 좀비물은 좀 잉스럽긴하지만 기계미도 만족또다른우...
10,
7,확실히 1편이 명작이긴 하네요 다소 아쉬웠어요
2,메트릭스 ㅜ.ㅜ시공의 초월과 긴박함을 느끼고 싶었는데 그냥 다큐멘터리. 무슨 설명을 그리 주절이주절이.
2,없던 일로 하자....
6,"생각보다 액션도 그저 그랬고, 설명하는 장면이 많아서 그런지 늘어지는 느낌. 그나마 영상미 하나 볼 만 했음"
10,역시 워쇼스키... 지상최고의 감독. 그녀는 성별은 버렸지만 그 감성과 위대한 철학은 버리지 않았음에 틀림이 없군요. 화이팅 워쇼스키!
2,보다가 너무 실망스러워 중간에 나옴..차라리 안보는게 나을뻔...
7,매트릭스1-3편 명작인데 반해 이번편은 아주 많이 아쉽다
9,진짜 감동과 감격의 연속매트릭스 3편의 사티의 성장그리고 기계의 분열인간의 편에 선 기계의 등장네오가 기억을 찾아가기의 과정그리고 기억을 찾은 네오가 새로운 세상(새로운 언어로 구성된 시스템) 적응하는 과정(c언어의...
10,매트릭스의 세계관이 너무 마음에 들고 재밌습니다 2021년에 걸맞는 스토리였습니다.
10,매트릭스는 그 자체만으로도 충분히 10점이다
1,기대하고 봤는데 너무 실망했네요...1편으로만 남았어야했던 매트릭스 시리즈
8,전작들과 비교해서 보면 ㅠㅠ 지루하고 지루했지만 네오와의 정으로 8점 드립니다
3,이 영화에서 건질 만한 장면은 단 2개…2시간 동안 2개 그건 네오 트리니티 재회와 트리니티외 네오의 짧은 더블 비행이다…그래서3점이다 그러므로 망작이다
4,매트릭스 트릴로지: 삼겹살 / 매트릭스 리저렉션: 가루 삼겹살 ???: 맛있는 삼겹살을 가루로 드셔보시겠습니까?
2,내 추억 돌려줘..내 시간도 돌려줘....
6,매트릭스의 오리지널리티와 독창성을 거세해버린 영화
4,매트릭스 찐팬이라면 이시점에 누가 뭘 기대했겠어 기대안했고 그시절의 간지만 좀 살려주라는 거자나.. 많은거 바란거 아닌데... 너무하잖아~! 쿠자쿠가뭐야 쿠자쿠가~~~~ 갑자기 뭔 애기들 신비와 환상의 세계냐구증맬루...
2,존윅인지 알았음. 내용도 뻔해서 별볼일 없음.
6,음 1년 대하철을 기다려서 대하구이를 먹으러 갔는데 세상에 대하머리만 먹고 몸통은 못 먹은 찝찝함
5,3편에서 끝냈어야 한다.너무 크게 실망 했다.
4,형제 둘 다 붕어알만 뗀 것이 아니었나 봄. 매트릭스한테 도대체 왜 그랬어요!!??
5,아쉬움 기존3부작에서 시간이 훨씬 지났지만 발전이없음
2,"매트릭스 200번 본 극성팬으로써 맘이 아프네요. 1편 나오고 말았어야 했는데, 2+3은 그래도 액션이라도, CG라도 대단 했음. 대체 이걸 왜 만든겁니까? 마블 영화를 10년 간 봐서 다들 눈은 화성 가 있는데, ..."
10,최고! 전작 암것두 안봤는데 매트릭스의 개념에  환상적으로 몰입할 수 있었습니다 이럼걸 상상한 제작진에게 감사드립니다
6,세기말엔 참 세련 됐었는데 거미맨 플어 내듯 따뜻하디 못하고 시간적으로 오히려 과거를 다룬 이번 킹스맨에 한참 뒤쳐진 대사와 연출.. 촌스럽... 어짤 수 없이 비교가 됨. 영화든 드라마든 대사로 교훈하는 순간......
8,미래로 가는 거 같아 즐겁게 봤습니다
8,전편이 너무 명작이라서... 하지만 대사가 장황한것 빼곤 나쁘지 않았음.
1,"매트릭스 놀이하는 유치함만 남았다..., 기존작의 AI에 대한 종교적 사유나 철학은 다 사라짐"
7,Cg는 볼만
2,나름 찐팬으로 살았습니다.기대를 많이 했었습니다.보지말걸 그랬습니다. ㅠㅠ
8,기대함으로  잘봤네요  한국은 역시 일본을 명분없이 시러하는군  나노그래픽기술  훌륭했네요 이해하기 어려운 시나리오는 어쩔수없는부분
5,"'희망과 절망이 거의 동일한 코드라는 거 알아?' 기존에 워낙 출중했던 세계관은 딱히 확장이랄 것도 없이 변주하는 수준인데, <매트릭스>에 대한 기존의 내 호감에 먹칠을 하는 이 B급 촬영과..."
1,"진짜 역대급 쓰레기영화..이미 해외에서도 매트릭스4에대해서 sucks, garbage,terrible등등 단어를 내뱉으며 최악이라고 평가하고있다.. 진짜 누가 나한테 돈을 준다며 한번더보라고해도 돈안받고 안볼영화다 ..."
3,기대치가 거의 없었는데도 실망했다 ㅋㅋ
1,매트릭스 영화 촬영 뒷얘기인줄... 맨인블랙보다 별로인 매트릭스... 집 와서 벙쪄서 1 다시 보는데 왜 이거 만든거지...?
10,이건 수입사의 마케팅 실패!
2,그냥 vod에서 보자 형말 들어라
10,"평범한 일상과 그 이면에 놓여 있는 또 다른 세계, 두 개의 현실이 존재하는 세상에서 운명처럼 인류를 위해 다시 깨어난 구원자 네오."
8,사랑의 멋짐을 모르는 당신이 불쌍해요! 트릴로지 때부터 네오의 원동력은 트리니티와의 사랑이었지. 그게 떠오르는 영화. 메타가 많아서 좋았다
2,전작에 대한 모독이다.
4,전편에 빨대 계속 꽂아대는데 노잼 대실망ㅠㅠ
4,네오가 장풍만 남발함. 너무 많이 손바닥질 해서 진부함
7,영화는 아쉽지만 멋진 배우들을 스크린으로 다시본것만 좋았음.
5,"안타깝다. 이럴거면 돌아오지 말지. 찬란하고 대단하고 멋있었던 내첫사랑이 20년만에 내 앞에 나타났는데 단순히 나이만 들은 것이 아니라, 심하게 망가진 상태로 내 앞에 나타난 느낌이랄까? 20여년간 기술은 발전했으되..."
6,중간에 아임엔그라운드 하는 줄 인사는 간단히 하고 설교만 안 했다면 더 괜찮았을텐데
10,이젠 늙어버린 네오와 트리니티에게서 여전한 열정을 느낄 수 있었음
4,감상포인트는 없고 성정체성은 대사속에서 계속 찾더라
10,다들 뭐가 그렇게 불만이죠??매트릭스 찐팬이라면 키아누 리브스와 캐리 앤 모스의 재조합만으로도 충분히 흥미로웠고 긴장됐어요.왜냐면 잠시나마 그 때 그  20년 전 젊은시절으로 돌아갈 수 있었으니까
2,매트릭스의 오래 묵은 기억이 이 영화의 생생한 현실보다 더 놀랍고 찬란하다.
2,진짜 최악임.영화보다 자긴 오랜만이네.크리스마스 이브를 망친 영화.
10,매트릭스 1을 처음봤을때의 전율이 잊혀지지 않는다 옛날 생각도 나고 매트릭스 4에서 키아누는 더이상 큰 액션은 하진 않지만 그래도 그의 등장만으로 압도적이다~~
10,최고의 영화였다매트릭스 안의 매트릭스 세계.. 끝없는 가상현실을 표현한 것도 좋았고결국 기계들이 지배하는 미래지구에서도 기계와 기계가 독립된 생명체로서 갈등하고 그들 나름의 감정과 연민으로 인간과 그 시대 나름의 형...
3,"저에게 매트릭스는 3부작 영화 네요.키아누형님과의 의리로 극장에서 봤지만 기억에서 삭제 하는걸로..매트릭스 시리즈 팬으로도 별로, 액션영화 한편으로 도 별로."
10,"단점은, 이전 매트릭스 시리즈를 봐야 더 감동이 크다는 것입니다. 장점은, 매트릭스 팬에게는 이보다 더하게 향수를 자극하는 영화는 없을거라는 것입니다. 호불호가 갈려서 저도 걱정하고 봤지만, 실제로는 훨씬 더 재미있..."
7,전반부 전개는 재밌음. 근데 후반부로 갈수록 전개나 설정에 대한 설명이 많이 부족함. 그리고 전작들에 비하면 격투액션이 영 아쉬움..그래도 시리즈 팬이라면 한번쯤 볼만한것 같긴 합니다
6,무슨수를 써서라도 기존배우를섭외했어야했다. 그럼 반가움이라도있었겠지
4,현실의 그래픽과 영화의 기계들은 발전했으나 네오는 나이가 먹었고... 액션도... 영화도....스토리도 나이가 들었다.
1,설명충과 좀비들의 향연
6,매트릭스의 패러디 같은 느낌...
7,예전꺼가 더 재밌는데 볼만은 했어요
1,도중 잘정도로 지루하고 액션이 긴장감이없음그리고 ㅈ도망한주제에 쿠키는 간격이 ㅈㄴ김사람들도 쿠키기다리다 나가던데ㅋㅋㅋㅋ
1,내가 매트릭스 시리즈를 영화관에서 보다가 잠들게 될줄은 몰랐다 다신 나오지 말아야 할 망작of망작
2,컴퓨터 코드폭포에 한자가 뜨길래 한문인가 했는데일본어였네..왜색이 끼니 망한거임..액션은 할배 액션인가?워매.. 왜 다시 만든겨?대 실망..
4,매트릭스 시리즈는 전부 봤고 큰기대 안했지만 졸다가 나옴..
5,리저렉션은 지나치게 1편의 감성팔이가 너무 심한듯.
3,실망이네요
5,휴고 위빙 캐스팅불발 된건 정말 다행이다. 휴고위빙이 나왔으면 본인의 필모그래피에 오점이 생겨서 속상했을텐데 그러지 않아서 다행임.매트릭스는 3에서 끝냈어야 했다.진정한 마스터피스는 매트릭스 1~3임. 4는 팬메이드...
