score,review
8,"전반부는 아주 흥미로웠는데, 후반부는 너무 전형적인 내용이라 매트릭스에서 기대한 무언가가 아니라서 아쉬웠어요.퀴어리티가 난무하는 세상 속에서 홀로 헤테로연애를 통해 세상을 구하는(웃음) 네오와 트리니티가 인상깊었습니..."
10,"아주 오래전에 1, 2만 봤고 복습도 2만 조금 하고 갔는데도 감동이 심했다. 새로운 시대에 맞춘 4의 서사가 기존 세계관, 철학과도 찰떡이라 감동 두 배.. 1과 4 사이에 그래도 내 의식이 조금은 성장했구나 싶어..."
2,이거 감독이 제작사에 빅엿을 먹인 영화임. 이제 매트릭스는 완전히 끝임
10,전작을 보지 못한 mz세대에겐 미안하지만20년전 향수를 느끼게한 걸작이다.매트릭스 세계관을 꼭 이해하고  관람을 추천한다.
4,1 >->-> 2 -> 3 >->->->->->->->->->-> 4
6,그때 그 매트릭스가 그립다면.
10,감동감동감동..! 스토리를 풀어내기 위해 중반부까지 지루할 수 있지만 .. 시리즈를 기다린 팬 입장에서 모든걸 이해할 수 있었습니다. 감동이네요!!
2,"옛날 제5침공, 샌안드레아스 생각나는 수준으로... 전락"
1,아 내 눈 안 본 눈 삽니다.
1,아~진짜! 도대체 왜 만든 거야????1.2.3전편이 대단한 걸작 이라는 걸 확인하기 위해 만든 거구만.
8,"모든면에서 조금씩 아쉽긴 해도 매트릭스 팬인 나에게는 너무나 좋은 영화, 눈을 땔 수 없었다."
6,....사족....
5,기대안하고 봤는데 기대 이하였음
10,
4,진짜 매드맥스처럼 만들지 못할거면 후속작 만들지 좀 마라
10,
10,다시 볼수 있다니. 매트릭스를ㅠ 너무 즐겁고 행복했다. 그들의 다음 이야기를 기대해본다!
4,매트릭스 이전 내용을 만들었더라면 훨씬 더 잼나지 안을까 기계와 인간이 왜 이렇게 되었는지 뻔히 알고 있는 내용이지만 그래도 영화로 나왔음 했는데..
4,개같이 부활 실패
1,액션: 허이짜! 허이짜!____스토리: 듬성 듬성____연출: 그까짓거 대충 그냥
7,네오와 트리니티 로맨스는 좋았는데 나머진 그닥...
8,매트릭스 123 보고 가시길!
2,매트릭스 특유의 녹색끼 도는 멋진 화면 땟갈은 온데간데 없고 왠 시트콤 같은 화면 질감이 거슬려서 영화에 집중을 할 수가 없네요.. 어찌 20년 전 보다 영상기술이 떨어져 보이는건지
4,차라리 만들지 말았어야했다는 기분이 강력하게 든다..기존 작품을 망치는 기분...
3,
5,역시나 부활(Resurrections)은 예수님만 하는것으로...
7,"여러가지 재밌게 새로운 시즌, 새로운 시작을 알린 듯합니다. 유머나 희화된 일부 스토리에 호불호가 있는 것 같은데, 이전작의 비장한 톤에 기대하지 않고 보시길 추천합니다~^^"
10,오랜만에 재미있게 봤습니다.
4,"이말 한마디로 모든게 정의됩니다. ""너무 성급했다.."""
1,트리니티와 네오의 재회는 반갑지만 굳이 추억을 다시금 빨간약으로 깨워야만 했을까 ?
4,짜집기라도 재밋게라도 하던가 지루해
2,와 지겨워 졸다 중간에 스톱
7,네오와 트리니티는 반가웠지만 굳이...
5,느닷없이 사랑이야기 좀비(?)물...
6,기대하지 않았으나 생각보다 더 실망 ..ㅠ
5,토끼굴이 아닌 웅덩이. 전편의 단점이 그대로 들어가 있다.
1,매트릭스 제목나올때까지만 재밌음.
2,최상급 포도를 가지고 식초를 만들어놨네...양아치들 몰려다니면서 총질하는 홍콩영화 딱 그 이상도 그 이하도 아니었다
9,좋아요 잘봤습니다.좋아요 잘봤습니다.좋아요 잘봤습니다.좋아요 잘봤습니다.
1,짱뿡;123456789
2,"매트릭스 처음 나왔을 때, 워쇼스키 형제를 천재라 생각했다.  하지만 스필버그나 제임스 카메론 달리. 지금은 바보같다 생각한다. 이건 완전 빗나간 후속작이다"
10,매트릭스 시리즈를 재탕에 재탕에 재탕을 거친 사람들 입장에서는 충분히 재미있게 볼 수 있는 작품임. 라나 워쇼스키가 많이 고민하고 만든 느낌이 들었음. 3편 이후로 스토리를 어떻게 만드려나 걱정됐었는데 새롭게 확장된...
6,젊은날 이루지 못한 중년의 로맨스
1,고결한 죽음으로 완벽한 결말로 끝난 영화를 왜 다시 살려내서 영화를 망쳐? 또 트리니티가 하늘을 날면 모피어스는 뭐가 되냐? 결국 상업용영화는 돈만 벌면 된다는거야
5,반갑지 근데 이건 뭐 추억 팔이도 안되네. 보다가 든 생각이 스우파들 추가 분장 없이 출연 가능하겠다 정도
1,OOO기 망작 감독이 일부러 영화를 엿같이 만든듯ㄱ
1,터미네이터 꼴 날 줄 알았던 나의 예상마저도 뛰어넘은 졸작. 전설은 전설로 남자 제발...매하다 추트릭스
8,팬으로서 다시 한 번 그시절의 감성을 추억하며충분히 볼만한 영화였음
2,20년의세월은 두 주인공의 노화를 가져왔다 1편의 네오와 트리티니는 없고 중년의 멜로만 남겼네
7,"잘 끝맺은 시리즈를, 영웅의 일대기를 마친 네오를 억지로 부활시킬 수 밖에 없게 만드는 IP 위주의 현대 영화 산업과 원 시리즈를 둘러싼 오독에 가까운 문화적 담론에 대한 냉소로 가득 찬 반-추억팔이 추억팔이 영화...."
1,그냥 똥 열자 쓰기도 아깝다
1,이걸 보느니 집에서 표값으로 쓸 돈으로 맛난 것들 사다 먹으며유튜브로 고양이 동영상 보는 게 훨씬 재미나겠다...
3,내 추억 돌려줘 왜 그런거야
1,말도많고 내용도재미없고 개실망함
4,음...반가움은 잠시... 예전만큼의 감흥은 기대하기 어려움.
10,
10,장담하는데 3부작나올거같고 1편은 2.3편을 위한 서막일뿐 기대감에 5점줌
4,부잣집은 망헤도 3냔이라고 헸었는데...
3,"박평식 ㅋㅋ 주절주절, 죽은 나무에 플라스틱 꽃 ㅋㅋㅋㅋ 근데 5점은 너무 후한거아냐? ㅎ 파란여자애랑 사티는 이쁨 트리니티 늙었는데 네오에 비하면 관리 잘한듯 네오 자꾸 존윅이랑 오버랩돼서 집중안댐 누구말대로 네오..."
3,"매트릭스가 다시 나와서 반갑기는 했는데..그냥 안나왔어도 됐겠다 싶을 정도였네.배우 캐스팅에 좀 더 신경쓰고차라리네오,트리니트는 무협지 곽정,황용 커플마냥 넘사벽 지존으로 등장하고 오락 영화로 가서 빵빵 터트리는 액..."
3,우려내다 못해 구멍 숭숭 뚫려버린 사골..차라리 만들지 말았어야
8,음. 네오가 해피하면 됐지 뭐
10,지금까지 이렇게 오래 이어진 이야기를 얼마나 더 잘 이어갈 수 있을까. 나는 기대 이상으로 만족 했다. 네오의 히어로물을 보고 싶어하는 남성관객들에게는 불 만족스러운 영화가 아닐까 싶다만 모든 이야기가 어벤저스 일 ...
6,매트릭스 안본 눈이라 4가 개봉한다기에 부랴부랴 1부터 3까지 달렸는데 어벤져스 세대인 나에겐 매트릭스1이 별로 감흥이 없었다. 그냥 1990년대에 이런 영화가 나왔다는게 놀라운거구나를 알고 4를 관람했는데 음 4랑...
5,실망.. 실망.. 실망의 연속..
5,다끝난 시리즈를ㅡ억지로ㅡ리셋ㅡ다시ㅡ3부작 만들듯ㅡ너무 억지스럽다ㅡ
2,완전 망해버림....
6,새로운 느낌이 없었다  아쉽다
5,지루하고 잠와 디질뻔했다 매트릭스 아니었으면 중간에 끗을 듯
2,매트릭스4...리저렉션...개인적으로 매트릭스1~3편까지 1~20년이 지나도 잊혀지지 않을 만큼 재미있게봤던 기억에 4개봉 소식을 접하고 너무 좋았다.4편을 접하기전 오랫만에 1~3편을 다시 봤고 1~20년이 지난 ...
9,새로운 매트릭스 다음회를 기다리며
5,3에서 끝났으면 반지의 제왕같은 3부작이라고 비빌수 있었지만 굳이 했어야 하는 내용으로 4편 만들어서 3편 엔딩에 남은 여운을 지워버림
4,3편으로 끝냈어야지....
2,총소리 들으면서 한 숨 푹 자고왔다
8,난 댓글 알바는 아니지만 나름 재밌게 만든 영화라고 생각함. 그러나 매트릭스 팬으로서 본 소감은 스토리가 좀 아쉽다.
2,기억에서 지우고 싶다.
10,20년만의  만남 반가웠음어뗳게 스토리 만드나 걱정했는데역시  ㅎ
8,
7,기대치가 높으면 실망이 크지만..후기를 보고가서 마음에 준비가 되어선지그렇게 나쁘진 않았음^^
3,오랜만에 잘 자고 나왔습니다. 그냥 스파이더맨 한번 더 보길 추천
2,그냥 워쇼스키 자매는 매트릭스 시리즈를 끝으로 접었어야 함
2,보는 그 순간부터 팝콘 대신 영상 필름을 십으며 자동으로 뒷목 잡고 쓰러지고 싶은 영화임   이런 경험 처음임
4,네오 형 너프 너무 씨게 먹은거 아녀?!!!
10,시대에 맞춰 새로운 세대들을 위한 매트릭스를 만드려는  라나 워쇼스키의 노력이 보이는 작품. 그 점 하나만으로도 볼 가치가 있는 영화이지만 다시 트리니티와 레오의 부활을 볼 수 있어 보는 내내 행복했던 영화.
1,모든 부분에 있어서 최악....차라리 건드리지 말지....왜 굳이 후속작을 냈을까...그리고 너무 깊이 묻어나는  pc문화는 보기에 답답하기 그지 없다....그래 그냥 여성 네오를 만들지 그랬어
1,너무 기대 했나봐..미안하지만 요 근래에 보기 힘든 망작...보는 내내 어이가 없을정도임.. 요즘에 나올수 없는 액션..무슨 액션이 얍 얍 얍 이리 공격할께! 오 그래 맞추는 데로 가자 얍 얍 이런 느낌?
3,와....심하게 재미없다....
2,"매트릭스 1,2,3 각각 100번 넘게 봤습니다.4는 한번만 보겠습니다."
1,대체 왜 낸 건가 싶다. 후속작 떡밥 있는데 나올 수 있을까
1,별 한개도 아깝습니다.
10,전 재미있게 봤어요. 후속작으로 이야기 이어나갈수 있어서 전 좋았던것 같아요. 새로 나오는 배우들도 연기 잘해요.
9,다소 뜬금없는 부분도 있었지만 재밌게 봤습니다! 만약 속편이 제작된다면 볼 의향이 있네요!
10,배우들만으로 최고인데 ost까지 매트릭스 시리즈 처음 봤는데 흥미로웠습니다. Sf물을 워낙 안보는지라;; 잠깐! 졸긴 했지만 액션과 영상미가 죽여줍니다. 캐릭터들도 매력만점
7,매트릭스 리저렉션의 영화는 개인적으로 시나리오는 좋았다고 생각된다. 전작의 주인공들인 네오와 트리니티를 어떻게 살릴지가 관심이었는데... 시나리오는 좋으나 영상미가 사실 좀비같은 등장은 좀 아니었지 않나 싶다. 워쇼...
4,"안쓰럽고 수준낮은 마지막 작품. 액션씬은 전반적으로 퇴보했고, 초반 1시간은 1편의 재탕이며, 1-3편의 반가운 캐릭터들마저 허무하게 등장한다. 스미스 요원은 3류 영화 수준으로 추락했고, 새로운 로봇 캐릭터들은 터..."
5,네오와 트리니티를 다시 스크린으로 만날수 있어서 반가웠지만그것말고는 왜 돌아왔는지는 이해가 안되었습니다
7,보다가 좀 지루했음… 그래도 옛날 영화 본 생각도 다시 나고 반가운 얼굴도 나와서 무난무난
6,워챠우스키 감독의 전성기는 끝난거 같다.
4,영화초반부 새로 나온 배우들이 하는 액션수준이 전~혀 준비안된 3류액션급이라 바로 느낌오긴했다.. 기대가 컷는데 진짜ㅡ ㅡ
1,내 그동안 본 수천편의 영화중에 단3개만 10점을 줬는데 그 중 하나가 매트릭스였다. 그런데 이건 1점이다. 더 이상의 설명은 생략한다...후.
2,"원작자가 만든게 아닌것 같은 B급 갬성, 실소가 터지는 액션의 조악함과 허약한 동작들,  전혀 새로운 씬이 없는 연출, 도입부의 엄청난 지루함, 알아먹지도 못할 대사들의 남발, 빅잼도 철학도 없이 질질끄는 네오+트리..."
1,재미 OOO 없으니까 각오하고 보셈
6,뭔 내용인지도 모르겠고 그냥 재미없음
2,일본물을 먹었는지 액션은 똥망이고 스토리도 산으로가고 주제는 시대에 뒤쳐졌다.
4,제작사에서 강제 제작 추진하여 명작을 망작으로
10,오랜만에 두배우모습 좋았다
6,과연 같은 감독의 영화가 맞나 의심스러울 정도다. 3류 아류작 느낌. 만들지 말았어야했어.
2,그냥 123에서 끝냈어야 했다. 액션은 그냥 soso 특수효과와 연출이 전작에 비해 촌스럽고 퇴보한 느낌이 들음. 거기에 지루함
1,0.5점 드리고 싶은데 1점 밖에 안되네요 영화 만드느라 고생하셨으니 0.5점 드립니다
1,"대체 왜 만들엇는가,, 왜 전설인 전편을 욕되게 하는가"
6,많이 아쉬웠지만 네오와 트리니티를 본 것으로 만족
10,5편 때는 우주론으로 가자!
6,
5,재미는 있었다만 기어이 끄집어낼 필요가 있었을까
7,1편을 좋아해서 의리로 봤지만 지루했어요
1,걍 보지마셈....매트릭스를 이렇게 망쳐버릴 수 있다는게 놀라울 따름이다
1,왜 감독의 마음변화를 내가 돈주고봐야하는가 난 매트릭스를 보고싶었을 뿐인데
2,키아누 형! 이제 매트릭스 고만볼꺼니까 형도 고만찍고  존윅 시리즈에 집중하장! 응?
1,매트릭스는 완전히 죽었다평점 알바 믿지마시길
3,
4,"실망이야 그냥 1,2,3편 다시보는게 이득"
7,죽은 자를 되살리는 건 어쩌면 엄청난 고민이 필요한 것일지도
2,실망했는데 기대 많이함.네오는 먹었어야 했다.. 파란약
10,처음 볼때는 기대했던 흐름이아니라 5점.다음 비우고 다시보니깐 그제서야 제대로 보이네. 10점!
6,미스터~앤더슨의 최근근황이 궁금하다면 GO
4,3에서 마무리 잘 지어놓고 끝낸 명작을 어거지로 끌고가네..쓸모없는 번외편이라 보면 될듯
4,워쇼스키 자매는 매트릭스 1편으로 끝냈어야 했다. 그러면 전설이라도 됐겠지. 상투적이고 식상하고 진부하다. 영화관에서 이렇게 오래 잔 영화도 처음.
2,"매트릭스 세계관을 이용한 3류 액션물 + 뜬금없는 좀비영화가 되어버림.오랜만에 나온 네오와 트리니티를 보는 것은 좋았지만, 매트릭스 세계관은 이미 3에서 완성되었기 때문에 4에서 나온 설정은 억지스러운 것이 너무 많..."
6,그냥 보통… 살짝 지루했음
5,"한마디로 정리하면, ""장풍 대 좀비의 대결""  // 전편 회상씬이 상영시간 10%이상 차지함. 1편에서 초연한 눈빛으로 'No…' 했을 때 감동따윈 없음. 마지막에 하늘을 무지개빛으로 칠..."
10,생각보다 괜찮아요... 연출보다는 스토리를 이렇게 풀었다는 것에 10점 드려요~
7,이런들 어떠하리 저런들 어떠하리... 출연진들 더 늙기 전에 언능 언능 다음편들도 찍어냅시다...
2,매트릭스1 다시보기 했는데 1이 더 흥미진진 하네 왜 연출이 후퇴한거 같지?? 대사중에 넌 예전에 너가 아니야 라는게 딱 맞아 떨어지네
2,현수야 돈받앗냐? 평점9점?ㅋㅋ평론가맞냐?
6,이럴거면 센스8 감독판 해 줘. 현기증 난단말이야!
7,트리니티와 레오의 희생으로 만들어진 기계인간과 시온의 휴전과 평화가 다시 파동을 치며 요동하기 시작했다. 또 다른 1편의 시작. 그런데.. 너무 늙어버렸어.. 57세 레오와 54세 트리니티라..
4,아니 한만 못했던 리저렉션(부활)
1,매트릭스 특유의 세기말 감성은 도대체 어디로 가고 마치 증손자의 재롱 잔치를 보는 것 같은 이 기분은 무엇일까..
4,"존윅이 마블 히어로 흉내내려고 하는 것 같음. 액션은 굼뜨고 힘겨워 보임. 키아누 형님, 세월을 정통으로 맞으셨네."
8,이전 시리즈들보다 좀 떨어지긴해도 이정도까지 혹평받을 수준은 아닌데..나름 볼만은 했네요 킹스맨보다는 재밌게 봄
6,초반은 좋았는데 뒤로 갈수록
1,이런 실망감을 어떻게 표현해야할까  차라리 일본애니 실사화가 더 볼만함
4,이야..이렇게 망치기도 쉽지않을텐데....
6,저 예산과 키아누리브스 형으로 콘스탄틴2를 찍었으면….ㅎㅎㅎ
9,재미없는줄 알았는데 잼있음. 스파이더맨 보다 훨재미있음.
1,그냥 보지마세요. 형제가 자매가 된 후엔 .. 다큐도 아니고 .. 캐스팅도 미스에다  특히  중국계 여배우..나중에 명절특선으로 보여줘도 욕 할거에요.
7,"아쉬울 뿐,,,1편에서 끝냈어야 했나 보다"
10,다시 만난 것만으로도 너무 반가움!!! 그 자체로 나에겐 10점 ㅠㅠ
8,영화를 보여주려고는 않고 주구장창 설명만. 지극히 남성적이어야 할 영화가 양성화된 느낌이랄까. 매트릭스 아침드라마 판.
5,감독이 강요에 의해 만들었다고 고백하는 듯한 장면도 숨어 있다. 이럴 거면 그냥 영화를 만들지 말지...
1,다운받아 보려했던 트래픽이 아쉬움
10,액션은 약간 부족하지만 앞으로 스토리 진행이 기대되는 리부트!
2,그냥 네오와 트리니티 살리려고 만든듯...
2,한마디로 겁나 재미없음
2,포브스가 선정한 '세상에서 가장 지루한 대사로 가득찬 영화' 1위.
4,감이 떨어지면 주우면 되는데 感이 떨어지면 줍지도 못할 이런 속편이 나온다. 네오는 양손드는거 말고 뭘 할줄 아는가..
4,대체 왜 만든 거지?? 장황한 수다와 자뻑.
8,예전 기억으로 돌아갈수 있어 좋앗고..  뉴 페이스도 좋앗지만..  두 주인공이 나이가있는데.. 리 스타트라면..  몇년후 5탄엔 누가 나올지 궁금 하네요..
5,이 시리즈를 잘 본 사람이라면 볼만 했을 듯
1,3류 싸구려 액션씬과 PC의 투톱
1,OOO기 영화^^ 토ㄹㅌ로 풀렸으니 다운받아서 보세요^^
8,"매트릭스 팬이라면 무지 반가움. 네오를 다시 보는 것도 재미있고,스토리도 생각보다 어렵지 않고. 단 런닝 타임이 길고 전 편들을 모두 이해하고 봐야재밌슴.만약 매트릭스 전편을 전혀 안 본 관객이라면 꽤나 지루할 듯...."
1,그냥 집에서 나혼자산다 재방이나 보세요.
2,하아 정말 왜...이따구로
4,굳이 4편을 …… 안본눈 삽니다
5,할말하않.... ㅠㅠ
10,비극적 결말에서 희극적 재탄생.. 못봐줄정도는아닌데..
4,매트릭스 리타이어로 이름 바꾸자
6,너무 재밌으면서 너무 졸렸음.
1,"돈주고 보면 진짜 아까운 시간낭비. 전형적인 중국 영화인데, 일본돈도 투자 된 듯. 중국영화 본다고 생각하면 됨. ㅋㅋㅋ. 발연기 끝장."
6,매트릭스! 네오면 됐지 뭘 바라?
2,야~ 이렇게 망쳐놓나?조연들 배우연기도 발연기에.. 내용도 뭔지 잘 모르겠고..너무 아쉽다.
8,"전작을 편 당 2~3회 본 사람으로서 모든 내용 이어서 후속편으로 만들어서 더 즐겁게 봤어요. 새로운 내용, 연출을 좋아하거나 전작 보지 않았다면 추천하지 않아요!"
4,1. 너무나도 허술해진 매트릭스. 1~3편에서 보여줬던 난공불락의 요새같았던 매트릭스는 사실상 없음. 그저 정치적 판도에 서있는 거대세력 중 하나로 전락. 3편에서 얻어낸 절반의 평화를 감안하더라도 이건 마치 개발자...
6,이렇게 만들거면...오히려 워쇼스키없는 매트릭스는 어땠을까 하는 생각이 드네요. 애당초 매트릭스 외의 후속작들 다 말아먹었던지라...
1,
6,새로운 관점의 매트릭스입니다.
6,어떻게 다 살았누? 그 많던 봇들 어디감?
6,"기술은 발전했으나 연출, 액션, 철학 모두 후퇴. 관객이 원하는 매트릭스와 감독이 만들고 싶었던 매트릭스의 간극만 크게 느껴진다. 초반은 괜찮다가 후반으로 갈수록 이상해지는 게 넷플릭스같은 OTT에 더 어울릴법한 영..."
6,리ㅓㅇㄴ리널나ㅓ리ㅓ
2,괴롭다 파란약을 먹고 1편으로 돌아가고 싶다
2,지금 극장에서 보고있는데 주변사람들 폰하거나 자고있는 사람들이 대다수 진짜 개노잼
4,"영화보는 2시간 내내, 518폭동을 일으킨 전라도인들이 문재앙 찬양하는 더러운 느낌하고 비슷해서 보기 힘들었음."
2,최악의  인생영화 하나 추가 입니다^^
2,터미네이터6편...다크페이트 보는느낌...워쇼스키 브라덜이 쌓은탑을 여동생이 맘먹고 무너뜨려버린 아까운 영화...엔더슨 목욕씬에서 머리위에 오리는 터미네이터3 아놀드가 별모양 썬그라스 꼈을때의 오마쥬!!!!암튼 내 ...
6,의리로 보기엔 2시간이 넘는 러닝타임이 너무 힘들었다.
1,감독이 걍 일뽕 ㅋㅋㄱㅂ
2,보다가 껐다. 영화가 대체 뭘 나타내고 싶은건지 모르겠다. 오히려 추억보정이 깨져버림
10,매트릭스 내 인생 최고의 영화였는데다시 그때 생각나게 해줘서 너무 고맙고 개재밌는데 평점을 왜 낮게 줬는지 이해가 안가네ㅎ 우리가 사는 세상도 매트릭스라는거 모르는거 아니지?양자역학 수학 음악 생명공학 등등만봐도 이...
1,츄리닝티 네옷 못피어스
2,자 4편은 없는걸로. 패미 pc 일본을 덕지덕지 바른 똥이네. 흔한 특촬물 한편보다 못하다.
1,충격적이다...나쁜쪽으로...
4,감독의 내적 혼란은 성정체성만이 아니었나보다. 운명은 결정된것인가 개척하는것인가 진실이란 거짓이나 무지보다 무조건 좋은것인가 우리의 삶은 매트릭스보다 더 가치있는것인가 여러가지 철학적 고민에 빠지게 만들었던 충격적 ...
6,다음편을 위한 준비과정 외에 무엇이 있었더라?
6,영화는 계속해서 인간에게 선택이라는 자유를 주고 추억팔이를 열심히 할뿐. 네오와 트리니티에겐 죄가 없다.
7,미스캐스팅으로 영화의 절반은 몰입 못했고 나머지 절반은 생각보다 나이든 배우들 때문에 매트릭스 123의 추억보정이 깨졌다... 7점은 매트릭스 전관예우 느낌...
10,아쉽긴하지만 네오형때문에 본다
3,안 나왔어도 좋았을 후속작. 결국 진부한 사랑 이야기.
7,중국 자본 들어간건가...여튼  감독이 제작사에게 불만 있는거 같다. 제작비도 부족했던거 같고  후속이  있다면  예전 느낌 살리면 좋겠다ㅜ.ㅜ(일단 난 나름  추억도 있고 괜찮게 봄)
1,간달프 젊을 적 보는 거 같읍니다
1,매트릭스 틀딱 버젼 비추 쉰네 남
1,핵폐기물이다....
10,나는 좋았다  그냥 좋았다 오래 못본 가족을 본 느낌 ㅎㅎ이것만으로도 나에겐 충분했다
1,뭐 이런 쓰레기 영화가;;; 내 인생동안 본 영화중 최악의 영화였다 그 정도가 너무 심해서 20년전 명작으로 추억에 남아있던 매트릭스들 마져도 쓰레기로 느껴질 정도다;;;; 미쳤다 내가 만들어도 이정도까진 아닐꺼다 ...
10,전편 보고 봐야 이해가 가능하지만 흐름 하나하나 맞물려 돌아가는것이 너무 좋다.승천하는줄
10,재미있네요. 예민충들은 못볼듯
5,20년전 매트릭스를 다시보자니 귀찮고... 내용을 떠올리려니 생각안나고... 뭔말인지 모르것다... 그러다 지루하게 끝난...
4,네오와 트리니티의 뒤늦은 연애 시뮬레이션이 시작되었다!!매트릭스를 알록달록 물들인다~~
1,모락모락 풍기는 중국자본 악취에 파란알약을 과다복용한 워쇼스키내 추억의 매트릭스는 3편에서 끝났다. 타국 문화에 대한 예의라곤 찾아볼 수 없는 중국은 질병 그 자체다
10,매트릭스3 이후에 벌어진 내용입니다. 매트리스를 무슨 단순 액션영화라고 생각하고 123 보신분들은 이해도 못하니 보지 마세요.
6,의리로..보는데..힘들었음..마음이 아픔ㅋ그래도 다봄^^;;
1,매트릭스 전 시리즈를 통 털어서 최악...액션이 화려한것도 아니고 스토리도 억지로 짜맞춘것같은 느낌에...왜 사람들이 역대 똥망했다고 한줄 알겠네...
6,
10,색안경끼고 보는 사람들 덕분에 평점 많이 내랴갔네이 영화의 깊이를 이해하기엔 당신들의 뇌 주름이 너무 적은듯
9,다들 별로라고 하지만 나는 너무 좋았다 흑흑
10,1편이 나왔을 때가 벌써 20년이 넘었다는게.. 참.. 1편을 봤을 때 너무 색다르고 센세이션을 일으킨 영화여서 재밌게 봤었어요. 이제 4편.. 미리 예고편이나 *튜브등을 통해서 기대감을 많이 낮춘 상태라서 그런지 ...
5,무엇을 상상하든 그이하를 보게됐숨
5,"중국 냄새가 난다. 어떤 영화 건 후속편에 중국자본 들어가면 망작 됨. 스타워즈, 스타트랙. 최애 영화2개 망쳤는데 매트릭스까지 마수를 뻗친건 아니겠지? 내 공상과학 3대 최애영화 3개 날라감. 쌍제이 아저씨 이제 ..."
8,평점 낮아서 진짜 너무 재미없나 싶었는데 ... 재밌었어요!!!
3,좋은 하루 되세요
1,최악의 디지털 쓰래기.
3,지겨움 3편으로 끝내라
